id	RsmmID	Titel	Serie	Länge	Sendezeit	Titel_Sprache	Beschreibung_Sprache	Block	MO	DI	MI	DO	FR	SA	SO	Bild
1018	41400	FGE BerichtWeltweit	FGE	00:46:00	01.02.2026 07:00:00	Original Christianity Worldwide. International Free Communities Under the Sign of the Lily. The Teachings of the Original Christians in the Messianic Sophianic Age - God in Us and We in God	Original Christianity Worldwide. International Free Communities Under the Sign of the Lily. The Teachings of the Original Christians in the Messianic Sophianic Age - God in Us and We in God		False	False	False	False	False	False	False	EN_BerichtWeltweit.jpg
1021	283	2.+3. Gebot	MED	00:27:30	01.02.2026 07:52:00	The Second and Third Commandments	Meditation - The Second and Third Commandments		False	False	False	False	False	False	False	2-3-Gebot.jpg
1029	24300	Medikurs2 03	MED	00:21:30	01.02.2026 08:30:00	Original Christian Meditation -  "The Power of Love Streams toward the Cells of My Body"	Original Christian Meditation -  "The Power of Love Streams toward the Cells of My Body"		False	False	False	False	False	False	False	Organansprache.jpg
1031	2716	IhreGedanken 15 7So	GH	00:11:30	01.02.2026 08:54:30	Thoughts for the Day - Week 15 - Sunday	Thoughts for the Day - Week 15 - Sunday		False	False	False	False	False	False	False	Woche08GedankenTag.jpg
1033	36391	SpürtHineinLeben	MED	00:18:00	01.02.2026 09:07:30	Meditation Prayer: Feel Into the Life	Meditation Prayer by Gabriele: Feel Into the Life		False	False	False	False	False	False	False	MedSpuertHinein.jpg
1037	34532	2KiZ-02 Gedankenwesen 2KiZ	LIOS	00:15:00	01.02.2026 09:31:00	Liobani: The Inuisible Thought-Beings. 	The school for New Jerusalem for another time under the sign of the Christ of God, the love for God and neighbor		False	False	False	False	False	False	False	LIOBANI_00.jpg
1039	5817	Knirps 26	GEKK	00:13:00	01.02.2026 09:46:30	How Pinzne, the Bear, Snacked on Honey	Children's Stories - How Pinzne, the Bear, Snacked on Honey		False	False	False	False	False	False	False	PizneDerBär.jpg
1041	45050	SchuleLeben 36	DWS	00:25:30	01.02.2026 10:00:00	The True School Is Life. Teaching Hours from the Divine Wisdom: "Where Are We with Our Consciousness?"   	Where Are We with Our Consciousness?		False	False	False	False	False	False	False	DieWahreSchule2.jpg
1044	33555	WoherAngst	MED	00:23:00	01.02.2026 10:33:30	Where Does Our Fear Come From? Given by Gabriele, The Prophetess and Emissary of the Eternal Kingdom	Where Does Our Fear Come From? Given by Gabriele, The Prophetess and Emissary of the Eternal Kingdom		False	False	False	False	False	False	False	WoherAngst.jpg
1050	36922	10 Gebote 3	LES	00:18:00	01.02.2026 11:02:00	The Ten Commandments of God - Interpreted with words of the present time. Part 3	The Ten Commandments of God - Interpreted with words of the present time. Part 3		False	False	False	False	False	False	False	EN_ZehnGebTeil3.jpg
1053	33457	LernenHineinzufühlen	MED	00:28:00	01.02.2026 11:24:30	Let Us Learn To Feel Into Our Neighbor. Given by Gabriele, The Prophetess and Emissary of the Eternal Kingdom	Let Us Learn To Feel Into Our Neighbor. Given by Gabriele, The Prophetess and Emissary of the Eternal Kingdom		False	False	False	False	False	False	False	33457_EN_LernHineinzufühlen.jpg
1063	35304	2KiZ-08 NimmLebenHand 2KiZ	LIOS	00:12:00	01.02.2026 12:01:00	Liobani: Take your Life in Hand. 	Liobani: Take your Life in Hand. The school for New Jerusalem for another time under the sign of the Christ of God, the love for God and neighbor		False	False	False	False	False	False	False	LiobaniSchule_EN.jpg
1065	40611	Berggeist 2KiZ	LIOS	00:22:00	01.02.2026 12:16:00	Liobani: The Mountain Spirit.	Liobani: The Mountain Spirit. The school for New Jerusalem for another time under the sign of the Christ of God, the love for God and neighbor		False	False	False	False	False	False	False	LiobaniJugend.jpg
1067	28170	BodenlebenErde	FILM	00:53:30	01.02.2026 12:40:00	Make the Connection: Planet Earth + Meat	Make the Connection: Planet Earth + Meat		False	False	False	False	False	False	False	Bodenleben2.jpg
1070	36890	10 Gebote 2	LES	00:20:30	01.02.2026 13:42:00	The Ten Commandments of God - Interpreted with words of the present time. Part 2	The Ten Commandments of God - Interpreted with words of the present time. Part 2		False	False	False	False	False	False	False	EN_ZehnGebTeil2.jpg
1073	41856	GottGegwLicht NEU	MED	00:25:30	01.02.2026 14:08:00	Meditation. God Is Present Light	Meditation. God Is Present Light		False	False	False	False	False	False	False	EN_MED_GottGegLicht.jpg
1076	27515	RufGabriele 8 WorteFÃ¼rDasLeben	SON	00:13:00	01.02.2026 14:41:00	The Call of Gabriele 08 - Words for the Life	The Call of Gabriele 08 - Words for the Life		False	False	False	False	False	False	False	Lilie.jpg
1079	45447	JesusKamFürTiere	LES	00:39:00	01.02.2026 15:00:00	Jesus of Nazareth Came for the Animals, too	Jesus of Nazareth Came for the Animals, too		False	False	False	False	False	False	False	EN_JesusKamTiere.jpg
1088	41788	SchuleLeben 30	DWS	00:28:30	01.02.2026 15:53:00	The True School Is Life. Teaching Hours from the Divine Wisdom: "Freedom, Unity and God's Love"   	Freedom, Unity and God's Love		False	False	False	False	False	False	False	EN_DWS30.jpg
1096	45226	GottVater Sept25	OFF	00:33:00	01.02.2026 16:28:00	God-Father gave a revelation in the Core Community of the Lord for the Building of the Kingdom of Peace of the Christ of God. On September 6, 2025, in year 2 of the Messianic, Sophianic Age    	God-Father gave a revelation in the Core Community of the Lord for the Building of the Kingdom of Peace of the Christ of God. On September 6, 2025, in year 2 of the Messianic, Sophianic Age    		False	False	False	False	False	False	False	EN_OFF_GottVaterSept2025_bearb.jpg
1100	9499	LassNichtLos	MED	01:00:00	01.02.2026 17:15:00	Don't Let Go - A Real Treasure from the Heavens	Don't Let Go - A Real Treasure from the Heavens		False	False	False	False	False	False	False	9499_EN_LassNichtLos.jpg
1103	2448	ProphStimme	SNJ-SN	00:30:00	01.02.2026 18:22:30	Prophetic Voice for the Animals	Prophetic Voice for the Animals		False	False	False	False	False	False	False	ProphStimme.jpg
1106	45050	SchuleLeben 36	DWS	00:25:30	01.02.2026 19:00:00	The True School Is Life. Teaching Hours from the Divine Wisdom: "Where Are We with Our Consciousness?"   	Where Are We with Our Consciousness?		False	False	False	False	False	False	False	DieWahreSchule2.jpg
1109	33555	WoherAngst	MED	00:23:00	01.02.2026 19:33:30	Where Does Our Fear Come From? Given by Gabriele, The Prophetess and Emissary of the Eternal Kingdom	Where Does Our Fear Come From? Given by Gabriele, The Prophetess and Emissary of the Eternal Kingdom		False	False	False	False	False	False	False	WoherAngst.jpg
1115	36922	10 Gebote 3	LES	00:18:00	01.02.2026 20:02:00	The Ten Commandments of God - Interpreted with words of the present time. Part 3	The Ten Commandments of God - Interpreted with words of the present time. Part 3		False	False	False	False	False	False	False	EN_ZehnGebTeil3.jpg
1118	33457	LernenHineinzufühlen	MED	00:28:00	01.02.2026 20:24:30	Let Us Learn To Feel Into Our Neighbor. Given by Gabriele, The Prophetess and Emissary of the Eternal Kingdom	Let Us Learn To Feel Into Our Neighbor. Given by Gabriele, The Prophetess and Emissary of the Eternal Kingdom		False	False	False	False	False	False	False	33457_EN_LernHineinzufühlen.jpg
1127	26948	RufGabriele 5 KommetZuMir	SON	00:08:00	01.02.2026 21:00:00	The Call of the Christ of God: Come to Me	The Call of Gabriele 05 - The Call of the Christ of God: Come to Me		False	False	False	False	False	False	False	Lilie.jpg
1129	281	Augenblicke	MED	00:14:00	01.02.2026 21:09:30	Moments with the Animals	Meditation - Moments with the Animals		False	False	False	False	False	False	False	281_EN_Augenblicke.jpg
1138	34532	2KiZ-02 Gedankenwesen 2KiZ	LIOS	00:15:00	01.02.2026 21:31:00	Liobani: The Inuisible Thought-Beings. 	The school for New Jerusalem for another time under the sign of the Christ of God, the love for God and neighbor		False	False	False	False	False	False	True	LIOBANI_00.jpg
1140	5817	Knirps 26	GEKK	00:13:00	01.02.2026 21:46:30	How Pinzne, the Bear, Snacked on Honey	Children's Stories - How Pinzne, the Bear, Snacked on Honey		False	False	False	False	False	False	False	PizneDerBär.jpg
1142	28507	InnereAndacht 03	MED	00:55:30	01.02.2026 22:00:00	Inner Devotional 3  - I, Chirst, Bring the Inner Reform	Inner Devotional 3  - I, Chirst, Bring the Inner Reform		False	False	False	False	False	False	False	InnereAndacht_00.jpg
1145	27362	Sternstunden 3	MED	00:41:30	01.02.2026 23:06:00	A Picture of Health, of Peace and of Inner Well-Being for the Person	Highlight Hour 03: A Picture of Health, of Peace and of Inner Well-Being for the Person		False	False	False	False	False	False	False	Sternstunden-08.jpg