id	RsmmID	Titel	Serie	Länge	Sendezeit	Titel_Sprache	Beschreibung_Sprache	Block	MO	DI	MI	DO	FR	SA	SO	Bild
1	43218	FGE BerichtWeltweit 02	FGE	00:27:00	11.05.2026 00:00:00	El cristianismo originario en todo el mundo. Colectividades libres internacionales bajo el signo del Lirio. La enseñanza de los cristianos originarios en la era mesiánica, sofiánica. Dios en nosotros y nosotros en Dios (2)	El cristianismo originario en todo el mundo. Colectividades libres internacionales bajo el signo del Lirio. La enseñanza de los cristianos originarios en la era mesiánica, sofiánica. Dios en nosotros y nosotros en Dios (2)		False	False	False	False	False	False	False	FGE_Rückmeldungen.jpg
3	42047	FGE VS Les 08 DuDasTier	FGE	00:07:00	11.05.2026 00:33:00	Somos las colectividades libres - Une y sé (8) 	Tú el animal, tú el hombre– quién tiene valores más elevados		False	False	False	False	False	False	False	ES_FGE_VerbindeUndSei.jpg
5	33147	JugendProphet 01	LES	00:25:00	11.05.2026 00:41:00	El joven y el profeta. 1ª parte	El joven y el profeta. 1ª parte		False	False	False	False	False	False	False	JugendlicheProphet2.jpg
7	35437	ImGespräch 8	GR	00:48:00	11.05.2026 01:07:00	Entrevista al Dr. Pierre Ibisch 	Conversando con... Dr. Pierre Ibisch, Catedrático de protección medioambiental		False	False	False	False	False	False	False	ImGespraech8.jpg
10	38609	Brache	DOK	00:18:00	11.05.2026 01:58:30	Una nueva agricultura para el nuevo tiempo	Hoy con el tema: El barbecho - tierra sana, frutos sanos		False	False	False	False	False	False	False	Weltengebet.jpg
12	10795	Sternstunden 01	MED	00:26:30	11.05.2026 02:21:00	Meditación: Horas estelares con Gabriele (1): El amor es la fuente de la salud	Meditación: Horas estelares con Gabriele (1): El amor es la fuente de la salud		False	False	False	False	False	False	False	Sternstunden-08.jpg
14	47068	Christus März26	OFF	00:18:30	11.05.2026 02:50:00	El Cristo de Dios se manifestó en la Comunidad base del Señor para la construcción del Reino de Paz del Cristo de Dios en marzo de 2026, el año 3 de la Era mesiánica, sofiánica	El Cristo de Dios se manifestó en la Comunidad base del Señor para la construcción del Reino de Paz del Cristo de Dios en marzo de 2026, el año 3 de la Era mesiánica, sofiánica		False	False	False	False	False	False	False	ChristusMärz26.jpg
17	47069	Gabriele März26	OFF	00:22:30	11.05.2026 03:15:00	El serafín de la Sabiduría divina se manifestó en la Comunidad base del Señor para la construcción del Reino de Paz del Cristo de Dios en marzo de 2026, el año 3 de la Era mesiánica, sofiánica	El serafín de la Sabiduría divina se manifestó en la Comunidad base del Señor para la construcción del Reino de Paz del Cristo de Dios en marzo de 2026, el año 3 de la Era mesiánica, sofiánica		False	False	False	False	False	False	False	GabrieleMärz26_3.jpg
20	36070	MachtDerLiebe	LES	01:12:00	11.05.2026 03:48:30	Quiero rezar al amor eterno	Mensaje de Cristo de Septiembre 2021. El poder del amor		False	False	False	False	False	False	False	GPH_00.jpg
28	02316	Perlen in uns	MED	00:46:00	11.05.2026 05:11:30	Meditación: Las perlas en nosotros. El Reino de Dios, nuestro Hogar eterno	Meditación: Las perlas en nosotros. El Reino de Dios, nuestro Hogar eterno		False	False	False	False	False	False	False	PerlenInUns.jpg
33	27347	Sternstunden 05	MED	00:39:00	11.05.2026 06:06:30	Horas estelares con Gabriele. El alma luminosa en la luz del Cristo de Dios	Horas estelares con Gabriele. El alma luminosa en la luz del Cristo de Dios		False	False	False	False	False	False	False	Sternstunden05.jpg
39	43155	FGE VS Les 21 WorteDesLebens	FGE	00:07:30	11.05.2026 06:50:00	Somos las colectividades libres - Une y sé (21) 	Palabras de vida 1		False	False	False	False	False	False	False	ES_FGE_VerbindeUndSei.jpg
41	21011	Medikurs1 10	MED	00:40:00	11.05.2026 07:00:00	Meditaciones cristiano-originarias. (Curso 1º, med. 10)	Meditaciones cristiano-originarias. (Curso 1º, med. 10): «Yo vivo en Cristo, en Su presencia»		False	False	False	False	False	False	False	Medikurs.jpg
45	46878	GottVater Feb26	OFF	00:36:00	11.05.2026 07:46:00	Una manifestación de Dios Padre durante la reunión de la Comunidad base del Señor para la construcción del Reino de Paz del Cristo de Dios, en febrero de 2026, del año 3 de la Era mesiánica, sofiánica  	Una manifestación de Dios Padre durante la reunión de la Comunidad base del Señor para la construcción del Reino de Paz del Cristo de Dios, en febrero de 2026, del año 3 de la Era mesiánica, sofiánica  		False	False	False	False	False	False	False	CHFeuerSchüssel.jpg
49	34564	2KiZ-04SaatUErnte1	LIOS	00:11:30	11.05.2026 08:29:00	Liobaní: El reino de los pensamientos.	La escuela para la Nueva Jerusalén, para otra época – bajo el signo del Cristo de Dios, del amor a Dios y al prójimo.		False	False	False	False	False	False	False	LiobaniSchule_ES.jpg
52	17888	IchBerate 04	LIOS	00:15:30	11.05.2026 08:42:30	LIOBANÍ: Los pensamientos, los entes invisibles. Los sentidos son como pequeñas antenas para que nuestra alma distinga lo bueno de lo negativo.	La Escuela-LIOBANÍ para jóvenes y adultos: Yo aconsejo. Y tú ¿lo aceptas? 4		False	False	False	False	False	False	False	Liobani.jpg
56	26939	Gemeinschaften 01	FGE	00:08:00	11.05.2026 09:02:00	Las colectividades libres bajo el signo del Lirio: Palabras y formas de comportamiento son energías. ¿A dónde van?	Las colectividades libres bajo el signo del Lirio: Palabras y formas de comportamiento son energías. ¿A dónde van?		False	False	False	False	False	False	False	Lilie.jpg
58	26940	Gemeinschaften 02	FGE	00:09:00	11.05.2026 09:16:00	Las colectividades libres bajo el signo del Lirio: ¿Cuál es el contenido de nuestros sentimientos, sensaciones, pensamientos y palabras?	Las colectividades libres bajo el signo del Lirio: ¿Cuál es el contenido de nuestros sentimientos, sensaciones, pensamientos y palabras?		False	False	False	False	False	False	False	Lilie.jpg
67	37873	LandBlühstreifen	DOK	00:17:00	11.05.2026 09:35:30	Una nueva agricultura para el nuevo tiempo: Campos floridos - ¡llenos de vida!	Un documental sobre una nueva agricultura en harmonía con la Naturaleza: Campos floridos - ¡llenos de vida!		False	False	False	False	False	False	False	LandBluehenStreifen.jpg
70	45208	TiereHierZuHause 01	DOK	00:14:30	11.05.2026 09:56:00	"Aquí estamos en casa" - animales en la tierra de la paz	"Aquí estamos en casa" - animales en la tierra de la paz		False	False	False	False	False	False	False	ES_DOK_TiereHierZuhause.jpg
73	32941	Sternstunden 12	MED	00:27:00	11.05.2026 10:14:30	Horas Estelares con Gabriele. Oración por la madre Tierra, por todas las formas de vida, por la unidad	Horas Estelares con Gabriele. Oración por la madre Tierra, por todas las formas de vida, por la unidad		False	False	False	False	False	False	False	SternstundenMargaritte.jpg
75	45342	Christus Okt25	OFF	00:32:00	11.05.2026 10:44:00	Una manifestación del Cristo de Dios durante la reunión de la Comunidad base del Señor para la construcción del Reino de Paz del Cristo de Dios. 	El 3 de octubre de 2025, el año 2 de la Era mesiánica, sofiánica		False	False	False	False	False	False	False	ChristusAbbildZelt.jpg
78	33440	Zelt GolgathaOpfer	OFF	01:04:30	11.05.2026 11:22:30	El Reino Eterno. El profundo significado del sacrificio en el Gólgota	El Reino Eterno. El profundo significado del sacrificio en el Gólgota		False	False	False	False	False	False	False	KreuzZeltMitGoldenePalmen.jpg
82	47187	Ostern 2026	SON	01:03:30	11.05.2026 12:40:00	La Fiesta de la Familia de Dios en la Tierra	Cristo, el Resucitado, vino por amor a toda la Creación.		False	False	False	False	False	False	False	ES_Ostern2026.jpg
88	02317	Vater Unser	MED	00:30:30	11.05.2026 13:53:00	Meditación con imágenes sobre el Padre Nuestro	Meditación con imágenes sobre el Padre Nuestro		False	False	False	False	False	False	False	Vaterworte.jpg
90	35768	GlaubeVertrauen	MED	00:34:00	11.05.2026 14:27:00	Oración meditativa: Fe y confianza	Dada por Gabriele, la profeta y enviada del Reino eterno el 28.02.2003		False	False	False	False	False	False	False	CH27GlaubeVertraue_ES.jpg
92	45001	SchuleLeben 34	DWS	00:25:00	11.05.2026 15:03:00	Solo quien se respeta a sí mismo, respeta también  a su prójimo	La verdadera escuela es la vida. Horas de enseñanza dadas desde la sabiduría divina		False	False	False	False	False	False	False	KindUndOpa.jpg
100	42049	FGE VS Les 10 ErfülltesLeben	FGE	00:06:30	11.05.2026 15:35:00	Somos las colectividades libres - Une y sé (10) 	Una vida plena hasta en la edad avanzada		False	False	False	False	False	False	False	ES_FGE_VerbindeUndSei.jpg
103	21011	Medikurs1 10	MED	00:40:00	11.05.2026 15:45:00	Meditaciones cristiano-originarias. (Curso 1º, med. 10)	Meditaciones cristiano-originarias. (Curso 1º, med. 10): «Yo vivo en Cristo, en Su presencia»		False	False	False	False	False	False	False	Medikurs.jpg
105	42179	BetenEinheit	MED	00:34:30	11.05.2026 16:28:00	Meditación. Rezar en la unidad, por la unidad	Meditación. Rezar en la unidad, por la unidad		False	False	False	False	False	False	False	GroßeGeister.jpg
109	34662	2KiZ-02LichtUSchatten	LIOS	00:11:30	11.05.2026 17:11:00	Liobaní: Luz y sombras en el alma y en el ser humano.	La escuela para la Nueva Jerusalén, para otra época – bajo el signo del Cristo de Dios, del amor a Dios y al prójimo.		False	False	False	False	False	False	False	LiobaniSchule_ES.jpg
112	09822	Knirps 26	GEKK	00:13:00	11.05.2026 17:23:30	El oso Pizne	Cuento para niños de Knipi, el duende cuentacuentos		False	False	False	False	False	False	False	PizneDerBär.jpg
114	33147	JugendProphet 01	LES	00:25:00	11.05.2026 17:38:00	El joven y el profeta. 1ª parte	El joven y el profeta. 1ª parte		False	False	False	False	False	False	False	JugendlicheProphet2.jpg
116	23709	DasIstMeinWort 08	LES	00:19:30	11.05.2026 18:04:00	Esta es Mi Palabra, Alfa y Omega. Capítulos 34 y 41: El amor de Jesús por todas las criaturas y la conversión del enjaulador	Esta es Mi Palabra, Alfa y Omega. Capítulos 34 y 41: El amor de Jesús por todas las criaturas y la conversión del enjaulador		False	False	False	False	False	False	False	DIMW_ES-00B.jpg
123	42047	FGE VS Les 08 DuDasTier	FGE	00:07:00	11.05.2026 18:30:30	Somos las colectividades libres - Une y sé (8) 	Tú el animal, tú el hombre– quién tiene valores más elevados		False	False	False	False	False	False	False	ES_FGE_VerbindeUndSei.jpg
126	42048	FGE VS Les 09 BotschaftAll	FGE	00:07:00	11.05.2026 18:41:00	Somos las colectividades libres - Une y sé (9) 	El mensaje del infinito		False	False	False	False	False	False	False	ES_FGE_VerbindeUndSei.jpg
128	24588	DasIstMeinWort 23	LES	00:21:00	11.05.2026 18:49:30	Esta es Mi Palabra, Alfa y Omega. Capítulo 69 "Acerca de la muerte, el renacimiento y la vida"	Esta es Mi Palabra, Alfa y Omega. Capítulo 69 "Acerca de la muerte, el renacimiento y la vida"		False	False	False	False	False	False	False	DIMW_ES-00.jpg
132	24265	DasIstMeinWort 24	LES	00:27:00	11.05.2026 19:19:00	Esta es Mi Palabra, Alfa y Omega. Capítulos 82 y 84 "La crucifixión de Jesús" y "La resurrección de Jesús"	Esta es Mi Palabra, Alfa y Omega. Capítulos 82 y 84 "La crucifixión de Jesús" y "La resurrección de Jesús"		False	False	False	False	False	False	False	DIMW_ES-00.jpg
134	32444	BotschaftAusDemAll 01	LES-ZELT	00:36:30	11.05.2026 19:49:00	Una lectura desde el Arca de la Alianza del Espíritu Libre: Manifestación dada a través de Gabriele, en Junio 1980: El Reino Eterno "O a favor de Mí o en contra de Mí, Cristo, el Hijo de Dios y Corregente del Reino de Dios"	Una lectura desde el Arca de la Alianza del Espíritu Libre: Manifestación dada a través de Gabriele, en Junio 1980: El Reino Eterno "O a favor de Mí o en contra de Mí, Cristo, el Hijo de Dios y Corregente del Reino de Dios"		False	False	False	False	False	False	False	LES-Zelt.jpg
136	29148	Klassik Seele 47e_20	KONZ1	00:19:30	11.05.2026 20:29:00	Música clásica para el alma. Los conciertos de la Santec Music Orchestra	Música clásica para el alma: Concierto para fagot y orquesta de W. A. Mozart (mayo 2015)		False	False	False	False	False	False	False	KlassikSeele.jpg
137	43514	AuflösungFormen 3	SON	00:53:00	11.05.2026 20:48:30	3ª parte. Los preparativos para la disolución de todas las formas condensadas y la segunda venida del Cristo de Dios. 	Parte 3: El retorno de los hijos de Dios. El regreso a la unidad con todo lo que vive y el Amor eterno.		False	False	False	False	False	False	False	ES_Aufloesung.jpg
139	45490	UrchristlicherStrom 03	SON	01:06:30	11.05.2026 21:42:00	La palabra profética en la corriente cristiano-originaria - hoy y en todos los tiempos - y el intento de exterminar las comunidades originarias, a los seguidores de Jesús de Nazaret. 3ª parte	La palabra profética en la corriente cristiano-originaria - hoy y en todos los tiempos - y el intento de exterminar las comunidades originarias, a los seguidores de Jesús de Nazaret. 3ª parte		False	False	False	False	False	False	False	ES_UrchristlicherStrom01.jpg
145	40348	AllesWasLebt	MED	00:37:00	11.05.2026 22:52:30	Meditación: En nosotros llevamos todo lo que vive	Meditación: En nosotros llevamos todo lo que vive		False	False	False	False	False	False	False	MED_AllesWasLebt.JPG
148	33147	JugendProphet 01	LES	00:25:00	11.05.2026 23:38:30	El joven y el profeta. 1ª parte	El joven y el profeta. 1ª parte		False	False	False	False	False	False	False	JugendlicheProphet2.jpg
150	23306	DasIstMeinWort 01	LES	00:23:00	12.05.2026 00:06:00	Esta es Mi Palabra, Alfa y Omega. Capítulo 38: Acerca del matar animales	Esta es Mi Palabra, Alfa y Omega. Capítulo 38: Acerca del matar animales		False	False	False	False	False	False	False	DIMW_ES-00.jpg
153	23332	DasIstMeinWort 02	LES	00:27:30	12.05.2026 00:34:30	Esta es Mi Palabra, Alfa y Omega. Capítulo 39: Parábola del Reino de los Cielos	Esta es Mi Palabra, Alfa y Omega. Capítulo 39: Parábola del Reino de los Cielos		False	False	False	False	False	False	False	DIMW_ES-00B.jpg
155	32035	FindePositiveNächsten	MED	00:26:30	12.05.2026 01:05:00	Encuentra y afirma lo positivo en tu prójimo. Por Gabriele. 	Un ejercicio para ampliar la consciencia para despertar la vida interna		False	False	False	False	False	False	False	FindePositiveImNächsten.jpg
161	47187	Ostern 2026	SON	01:03:30	12.05.2026 01:40:00	La Fiesta de la Familia de Dios en la Tierra	Cristo, el Resucitado, vino por amor a toda la Creación.		False	False	False	False	False	False	False	ES_Ostern2026.jpg
165	27606	InnererWeg 16	GR-IW	00:26:30	12.05.2026 02:45:30	Motivación para el Camino Interno - Resumen	El Camino interno hacia la Consciencia cósmica. Peldaño del Orden. Programa 16		False	False	False	False	False	False	False	IW_ES.jpg
169	34110	Bergpredigt 07	LES	00:26:30	12.05.2026 03:20:00	El Sermón de la Montaña de Jesús de Nazaret. Parte 7	El Sermón de la Montaña de Jesús de Nazaret. Parte 7		False	False	False	False	False	False	False	Berg_ES-00.jpg
175	47175	Christus Ostern25	OFF	00:25:30	12.05.2026 03:57:00	El Cristo de Dios se manifestó en la Comunidad base del Señor para la construcción del Reino de Paz del Cristo de Dios en Semana Santa de 2025, el año 2 de la Era mesiánica, sofiánica	El Cristo de Dios se manifestó en la Comunidad base del Señor para la construcción del Reino de Paz del Cristo de Dios en Semana Santa de 2025, el año 2 de la Era mesiánica, sofiánica		False	False	False	False	False	False	False	ES_OFF_Christus-Ostern2025.jpg
177	39319	Herzensgebete	MED	00:13:00	12.05.2026 04:28:30	Oración meditativa: La oración de corazón es alimento para el alma	Oración meditativa: La oración de corazón es alimento para el alma		False	False	False	False	False	False	False	InnereRuhe.jpg
179	36881	10 Gebote 1	LES	00:29:00	12.05.2026 04:42:00	Los Diez Mandamientos de Dios.  Parte 1	Coloquio sobre: Los Diez Mandamientos de Dios expuestos con las palabras del tiempo actual. Parte 1		False	False	False	False	False	False	False	ZehnGebote.jpg
181	35875	SchuleLeben 13	DWS	00:32:00	12.05.2026 05:14:00	Aprender a amar, ganar libertad, ser feliz	La verdadera escuela es la vida. Horas de enseñanza dadas desde la Sabiduría divina.La verdadera escuela es la vida. Horas de enseñanza dadas desde la Sabiduría divina.La verdadera escuela es la vida. Horas de enseñanza dadas desde la Sabiduría divina.		False	False	False	False	False	False	False	Gänse.jpg
185	41749	FGE VS Les 03 BroschEwGesetz	FGE	00:06:00	12.05.2026 05:57:30	Somos las colectividades libres - Une y sé (3) 	El cristianismo originario en todo el mundo. Las colectividades libres bajo el signo del Lirio		False	False	False	False	False	False	False	ES_FGE_VerbindeUndSei.jpg
190	35758	SchuleLeben 12	DWS	00:27:00	12.05.2026 06:13:00	Aprendemos a focalizar	La verdadera escuela es la vida. Horas de enseñanza dadas desde la Sabiduría divina.		False	False	False	False	False	False	False	Blume_Fokusieren.jpg
193	43189	ErlangeGotteserfahrung	MED	00:19:30	12.05.2026 06:42:30	Meditación. Logra experimentar a Dios	Meditación. Logra experimentar a Dios		False	False	False	False	False	False	False	ES_ErlangeGottesErfahrung.jpg
199	38560	Morgenmed. 2	MED	00:12:30	12.05.2026 07:07:30	Meditación matinal: La Nueva Era que está llegando, la época de la renovación de la consciencia	Meditación matinal: La Nueva Era que está llegando, la época de la renovación de la consciencia		False	False	False	False	False	False	False	Tagesgestaltung.jpg
202	45343	Christus Nov25	OFF	00:22:30	12.05.2026 07:25:00	El Cristo de Dios se manifestó durante la reunión de la Comunidad base del Señor para la venida del Cristo de Dios. 	El 8 de noviembre de 2025, año 2 de la Era mesiánica, sofiánica		False	False	False	False	False	False	False	ChristusAbbildUndTische.jpg
204	08039	VerweileInDir	MED	00:17:00	12.05.2026 07:50:30	Meditación: Permanece en ti. Aprovecha el día	Meditación: Permanece en ti. Aprovecha el día		False	False	False	False	False	False	False	ErlebeDieEinheit.jpg
207	34661	2KiZ-02DieInkarnatio	LIOS	00:23:30	12.05.2026 08:09:30	Liobaní: Las encarnaciones del alma.	La escuela para la Nueva Jerusalén, para otra época – bajo el signo del Cristo de Dios, del amor a Dios y al prójimo.		False	False	False	False	False	False	False	LIOBANI_00.jpg
209	17890	IchBerate 06	LIOS	00:15:00	12.05.2026 08:33:30	LIOBANÍ: Cada persona es diferente porque tiene un estado de consciencia diferente	La Escuela-LIOBANÍ para jóvenes y adultos: Yo aconsejo. Y tú ¿lo aceptas? 6		False	False	False	False	False	False	False	Liobani.jpg
212	24559	Planeten 5	FILM	00:14:00	12.05.2026 08:51:00	Punto de mira TIERRA: ¿Ha hecho el hombre recelosos y agresivos a muchos animales?	¿Son los animales agresivos por su propia naturaleza o ha contriubido el ser humano a ello?		False	False	False	False	False	False	False	Planeten-5.jpg
214	23413	DasIstMeinWort 03	LES	00:21:00	12.05.2026 09:06:00	Esta es Mi Palabra, Alfa y Omega. Capítulo 43: El rico y el Reino de los Cielos	Esta es Mi Palabra, Alfa y Omega. Capítulo 43: El rico y el Reino de los Cielos		False	False	False	False	False	False	False	DIMW_ES-00.jpg
217	23414	DasIstMeinWort 04	LES	00:22:00	12.05.2026 09:32:30	Esta es Mi Palabra, Alfa y Omega. Capítulo 28: Jesús libera a los animales	Esta es Mi Palabra, Alfa y Omega. Capítulo 28: Jesús libera a los animales		False	False	False	False	False	False	False	DIMW_ES-00.jpg
219	04561	Gabe Selbsthilfe	MED	00:23:00	12.05.2026 09:57:30	Meditación: Dones para la autoayuda	Meditación: Dones para la autoayuda		False	False	False	False	False	False	False	GabeSelbsthilfe.jpg
225	09417	InnererArzt 3	MED	00:44:30	12.05.2026 10:29:00	El Médico y Sanador interno. Sanar en cuerpo y alma por la fuerza del Cristo de Dios. (4)	El Médico y Sanador interno. Sanar en cuerpo y alma por la fuerza del Cristo de Dios. (4)		False	False	False	False	False	False	False	P4150048.jpg
232	27606	InnererWeg 16	GR-IW	00:26:30	12.05.2026 11:21:00	Motivación para el Camino Interno - Resumen	El Camino interno hacia la Consciencia cósmica. Peldaño del Orden. Programa 16		False	False	False	False	False	False	False	IW_ES.jpg
236	34111	Bergpredigt 08	LES	00:26:30	12.05.2026 11:55:30	El Sermón de la Montaña de Jesús de Nazaret. Parte 8	El Sermón de la Montaña de Jesús de Nazaret. Parte 8		False	False	False	False	False	False	False	Berg_ES-00.jpg
243	47201	Christus Ostern26	OFF	00:27:30	12.05.2026 12:33:30	El Cristo de Dios se manifestó en la Comunidad base del Señor para la construcción del Reino de Paz del Cristo de Dios el Viernes Santo de 2026, el año 3 de la Era mesiánica, sofiánica	El Cristo de Dios se manifestó en la Comunidad base del Señor para la construcción del Reino de Paz del Cristo de Dios el Viernes Santo de 2026, el año 3 de la Era mesiánica, sofiánica		False	False	False	False	False	False	False	ES_OFFChristusOstern26.jpg
245	07030	InnereLeben x	MED	00:12:00	12.05.2026 13:07:00	Meditación: La vida interna es el Espíritu	Meditación: La vida interna es el Espíritu		False	False	False	False	False	False	False	InnereLeben.jpg
247	08333	JederAtemzug	MED	00:30:00	12.05.2026 13:19:30	Meditación: Cada respiración es presencia de Dios	Meditación: Cada respiración es presencia de Dios		False	False	False	False	False	False	False	JederAtemzug.jpg
248	36882	10 Gebote 2	LES	00:20:30	12.05.2026 13:49:30	Los Diez Mandamientos de Dios.  Parte 2	Coloquio sobre: Los Diez Mandamientos de Dios expuestos con las palabras del tiempo actual. Parte 2		False	False	False	False	False	False	False	ZehnGebote.jpg
250	35876	SchuleLeben 14	DWS	00:24:30	12.05.2026 14:13:00	Armonía es la vida de la empresa	La verdadera escuela es la vida. Horas de enseñanza dadas desde la Sabiduría divina.		False	False	False	False	False	False	False	DWSharmonieBetriebe.jpg
257	27556	Sternstunden 04	MED	00:39:30	12.05.2026 15:00:00	Horas estelares con Gabriele. Un hombre nuevo en la corriente del amor infinito	Horas estelares con Gabriele. Un hombre nuevo en la corriente del amor infinito		False	False	False	False	False	False	False	SternstundenMargaritte.jpg
261	37546	SchuleLeben 21	DWS	00:22:30	12.05.2026 15:45:00	En la Ley de Dios vivimos libres. ¡Date prisa o déjate tiempo para la eternidad!	La verdadera escuela es la vida. Horas de enseñanza dadas desde la Sabiduría divina.		False	False	False	False	False	False	False	BahnhofsUhr.jpg
267	42340	FGE VS Les 19 SchuleLeben	FGE	00:06:30	12.05.2026 16:12:00	Somos las colectividades libres - Une y sé (19) 	La verdadera escuela es la vida		False	False	False	False	False	False	False	ES_FGE_VerbindeUndSei.jpg
269	21011	Medikurs1 10	MED	00:40:00	12.05.2026 16:20:30	Meditaciones cristiano-originarias. (Curso 1º, med. 10)	Meditaciones cristiano-originarias. (Curso 1º, med. 10): «Yo vivo en Cristo, en Su presencia»		False	False	False	False	False	False	False	Medikurs.jpg
271	02365	IhreGedanken 16 5Fr	GH	00:13:00	12.05.2026 17:04:30	Sus pensamientos son su día: Confía en Cristo	Meditación con imágenes con impulsos para el día		False	False	False	False	False	False	False	Woche08GedankenTag.jpg
275	44946	2KiZ-03AufgabeNaturw	LIOS	00:14:00	12.05.2026 17:22:00	Liobaní: Las tareas de los seres naturales. 	La escuela para la Nueva Jerusalén, para otra época – bajo el signo del Cristo de Dios, del amor a Dios y al prójimo.		False	False	False	False	False	False	False	LIOS_Naturwesen.jpg
278	09829	Knirps 37 FrSo	GEKK	00:12:00	12.05.2026 17:37:00	El toro "Cariñoso", 2ª parte	Cuento para niños de Knipi, el duende cuentacuentos		False	False	False	False	False	False	False	MKStierliebevoll.jpg
281	23314	Klassik Seele 41c_09	KONZ1	00:08:30	12.05.2026 17:51:30	Música clásica para el alma. Los conciertos de la Santec Music Orchestra	Música clásica para el alma: Concierto para flauta, fagot y orquesta en Sol menor RV 106, de Antonio Vivaldi (Sept. 2014)		False	False	False	False	False	False	False	KlassikSeele.jpg
282	35318	SchuleLeben 04	DWS	00:20:30	12.05.2026 18:00:00	Cada cual forja su destino	La verdadera escuela es la vida. Horas de enseñanza dadas desde la Sabiduría divina.		False	False	False	False	False	False	False	DWS-ES_00B.jpg
288	30817	InnereAndacht 19	MED	01:00:00	12.05.2026 18:24:00	Experimenta la cercanía de Dios en el silencio interno	Recogimiento Interno. Parte 19. Grabación original de la serie de enseñanza "Las grandes enseñanzas cósmicas de Jesús de Nazaret a sus apósteles y discípulos que podían captarlas"		False	False	False	False	False	False	False	InnereAndacht19.jpg
292	00310	2.+3. Gebot	MED	00:27:00	12.05.2026 19:26:30	Meditación: El 2° y 3° Mandamiento de Dios	Meditación: El 2° y 3° Mandamiento de Dios		False	False	False	False	False	False	False	2-3-Gebot.jpg
294	29131	Gemeinschaften 09	FGE	00:28:30	12.05.2026 19:56:30	Las colectividades libres bajo el signo del Lirio: Desarrollamos nuestra herencia divina	Las colectividades libres bajo el signo del Lirio: Desarrollamos nuestra herencia divina		False	False	False	False	False	False	False	FGE_Menschen.jpg
297	42047	FGE VS Les 08 DuDasTier	FGE	00:07:00	12.05.2026 20:34:30	Somos las colectividades libres - Une y sé (8) 	Tú el animal, tú el hombre– quién tiene valores más elevados		False	False	False	False	False	False	False	ES_FGE_VerbindeUndSei.jpg
299	32210	Sternstunden 09	MED	00:46:00	12.05.2026 20:44:00	Horas Estelares con Gabriele. Salud y dicha vienen del interior. Grabación en directo del 20 de sept. de 2002	Horas Estelares con Gabriele. Salud y dicha vienen del interior. Grabación en directo del 20 de sept. de 2002		False	False	False	False	False	False	False	Sternstunden-08.jpg
