id	RsmmID	Titel	Serie	Länge	Sendezeit	Titel_Sprache	Beschreibung_Sprache	Block	MO	DI	MI	DO	FR	SA	SO	Bild
921	42341	FGE VS Les 20 ErfülltesLeben2	FGE	00:07:30	17.05.2026 05:46:00	Somos las colectividades libres - Une y sé (20) 	Una vida plena hasta en la edad madura 2		False	False	False	False	False	False	False	ES_FGE_VerbindeUndSei.jpg
924	06544	Morgenmed. 3	MED	00:18:00	17.05.2026 05:59:00	Meditación matinal (17)	Meditación matinal (17)		False	False	False	False	False	False	False	ErlebeDieEinheit.jpg
927	38110	SchuleLeben 24	DWS	00:19:30	17.05.2026 06:20:30	Reencarnación y renacimiento en espíritu	La verdadera escuela es la vida. Horas de enseñanza dadas desde la Sabiduría divina.		False	False	False	False	False	False	False	Reinkarnation.jpg
930	02366	IhreGedanken 16 7So	GH	00:12:00	17.05.2026 06:44:30	Sus pensamientos son su día: Descansar en Dios	Meditación con imágenes con impulsos para el día		False	False	False	False	False	False	False	Woche08GedankenTag.jpg
936	41749	FGE VS Les 03 BroschEwGesetz	FGE	00:06:00	17.05.2026 07:01:00	Somos las colectividades libres - Une y sé (3) 	El cristianismo originario en todo el mundo. Las colectividades libres bajo el signo del Lirio		False	False	False	False	False	False	False	ES_FGE_VerbindeUndSei.jpg
939	27219	RufGabriele 6 DerRuf	SON	00:13:00	17.05.2026 07:11:30	La llamada de Gabriele (6): La llamada del Cristo de Dios. Dada por Gabriele, la profeta y enviada de Dios	La llamada de Gabriele (6): La llamada del Cristo de Dios. Dada por Gabriele, la profeta y enviada de Dios		False	False	False	False	False	False	False	Ruf-6.jpg
941	21011	Medikurs1 10	MED	00:40:00	17.05.2026 07:25:30	Meditaciones cristiano-originarias. (Curso 1º, med. 10)	Meditaciones cristiano-originarias. (Curso 1º, med. 10): «Yo vivo en Cristo, en Su presencia»		False	False	False	False	False	False	False	Medikurs.jpg
943	33647	JugendProphet 03	LES	00:22:00	17.05.2026 08:06:30	El joven y el profeta. 3ª parte	El joven y el profeta. 3ª parte		False	False	False	False	False	False	False	JugendlicheProphet3.jpg
945	40241	3KiZ-13Prüfungen 	LIOS	00:24:00	17.05.2026 08:29:30	Liobaní: Exámenes orales y escritos. 	La escuela para la Nueva Jerusalén, para otra época – bajo el signo del Cristo de Dios, del amor a Dios y al prójimo.		False	False	False	False	False	False	False	Prüfungen.jpg
949	41955	Lilienzeitalter1 Sophia WEB	LES	00:55:30	17.05.2026 09:00:00	La Era del lirio, Sophia, la Sabiduría de Dios. Los cuatro niveles de desarrollo, la cuna evolutiva hacia la filiación en Dios. 1ª parte	La Era del lirio, Sophia, la Sabiduría de Dios. Los cuatro niveles de desarrollo, la cuna evolutiva hacia la filiación en Dios. 1ª parte		False	False	False	False	False	False	False	ES_OFFZelt4EntwicklungP1.jpg
951	08248	Zuversicht 3	MED	00:19:30	17.05.2026 09:59:00	Meditación: Confianza (3) - «Recoge una y otra vez tus pensamientos positivos y oriéntalos hacia las fuerzas del Cristo de Dios en ti»	Meditación: Confianza (3) - «Recoge una y otra vez tus pensamientos positivos y oriéntalos hacia las fuerzas del Cristo de Dios en ti»		False	False	False	False	False	False	False	Schmetterling1.jpg
955	39755	AllesKommunikation2 WEB	LES	01:06:00	17.05.2026 10:26:30	Todo es comunicación	La era mesiánica sofiánica. Todo es comunicación. Enseñanzas espirituales divinas de Gabriele, la profeta y enviada de Dios, dadas en marzo de 2019		False	False	False	False	False	False	False	AllesKommunikation2.jpg
962	05493	Abendmed. 08	MED	00:12:00	17.05.2026 11:40:30	Meditación noche (8): ¿Cómo fue su día?	Meditación noche (8): ¿Cómo fue su día?		False	False	False	False	False	False	False	Abendmed.jpg
967	43189	ErlangeGotteserfahrung	MED	00:19:30	17.05.2026 12:02:00	Meditación. Logra experimentar a Dios	Meditación. Logra experimentar a Dios		False	False	False	False	False	False	False	ES_ErlangeGottesErfahrung.jpg
971	09823	Knirps 25	GEKK	00:12:30	17.05.2026 12:26:00	Historia de hormigas	Cuento para niños de Knipi, el duende cuentacuentos		False	False	False	False	False	False	False	MKAmeiseng.jpg
974	25572	SchneemannTraurig TB	GEKK	00:11:00	17.05.2026 12:41:00	El muñeco de nieve "Triste"	Cuento animado para niños		False	False	False	False	False	False	False	SchneemannTraurig.jpg
980	14924	Planeten 4	FILM	00:52:00	17.05.2026 13:01:00	Punto de mira TIERRA: La belleza de la Creación y la campaña del hombre contra la vida	¿Está el ser humano en contra de la vida? Cómo respetar la vida y su belleza		False	False	False	False	False	False	False	Planeten-4.jpg
988	43488	FGE VS Les 23 TrostNotLeid	FGE	00:07:00	17.05.2026 14:02:30	Somos las colectividades libres - Une y sé (23) 	Consuelo en la necesidad y el sufrimiento		False	False	False	False	False	False	False	ES_FGE_VerbindeUndSei.jpg
990	09340	InnererArzt 1	MED	00:39:00	17.05.2026 14:12:30	El Médico y Sanador interno. Sanar en cuerpo y alma por la fuerza del Cristo de Dios. (1)	El Médico y Sanador interno. Sanar en cuerpo y alma por la fuerza del Cristo de Dios. (1)		False	False	False	False	False	False	False	Kristall.jpg
998	33558	WoherAngst	MED	00:23:00	17.05.2026 15:04:30	¿De dónde viene nuestro miedo?	¿De dónde viene nuestro miedo?		False	False	False	False	False	False	False	WoherAngst.jpg
1000	36032	SchuleLeben 15	DWS	00:28:00	17.05.2026 15:30:30	¿Qué es libertad? ¿Con qué nos la hemos quitado? ¿Y cómo la podemos recuperar?	La verdadera escuela es la vida. Horas de enseñanza dadas desde la Sabiduría divina.		False	False	False	False	False	False	False	Lilienzeitalter.jpg
1007	42221	FGE VS Les 14 Reinkarnation	FGE	00:07:00	17.05.2026 16:05:30	Somos las colectividades libres - Une y sé (14) 	Reencarnación –un don de gracia de la vida		False	False	False	False	False	False	False	ES_FGE_VerbindeUndSei.jpg
1010	07030	InnereLeben x	MED	00:12:00	17.05.2026 16:15:00	Meditación: La vida interna es el Espíritu	Meditación: La vida interna es el Espíritu		False	False	False	False	False	False	False	InnereLeben.jpg
1014	21011	Medikurs1 10	MED	00:40:00	17.05.2026 16:33:00	Meditaciones cristiano-originarias. (Curso 1º, med. 10)	Meditaciones cristiano-originarias. (Curso 1º, med. 10): «Yo vivo en Cristo, en Su presencia»		False	False	False	False	False	False	False	Medikurs.jpg
1016	39319	Herzensgebete	MED	00:13:00	17.05.2026 17:15:30	Oración meditativa: La oración de corazón es alimento para el alma	Oración meditativa: La oración de corazón es alimento para el alma		False	False	False	False	False	False	False	InnereRuhe.jpg
1019	35301	2KiZ-05Gemütsschwankung 	LIOS	00:13:00	17.05.2026 17:33:30	Liobaní: Los altibajos del ánimo durante el día. 	La escuela para la Nueva Jerusalén, para otra época – bajo el signo del Cristo de Dios, del amor a Dios y al prójimo.		False	False	False	False	False	False	False	EntschprecungJPG.jpg
1021	09828	Knirps 36 FrSo	GEKK	00:12:00	17.05.2026 17:47:00	El toro "Cariñoso", 1ª parte	Cuento para niños de Knipi, el duende cuentacuentos		False	False	False	False	False	False	False	MKStierliebevoll.jpg
1023	23413	DasIstMeinWort 03	LES	00:21:00	17.05.2026 18:00:00	Esta es Mi Palabra, Alfa y Omega. Capítulo 43: El rico y el Reino de los Cielos	Esta es Mi Palabra, Alfa y Omega. Capítulo 43: El rico y el Reino de los Cielos		False	False	False	False	False	False	False	DIMW_ES-00.jpg
1026	23414	DasIstMeinWort 04	LES	00:22:00	17.05.2026 18:26:30	Esta es Mi Palabra, Alfa y Omega. Capítulo 28: Jesús libera a los animales	Esta es Mi Palabra, Alfa y Omega. Capítulo 28: Jesús libera a los animales		False	False	False	False	False	False	False	DIMW_ES-00.jpg
1028	04561	Gabe Selbsthilfe	MED	00:23:00	17.05.2026 18:51:30	Meditación: Dones para la autoayuda	Meditación: Dones para la autoayuda		False	False	False	False	False	False	False	GabeSelbsthilfe.jpg
1034	46718	Urlicht 07	MED	00:57:30	17.05.2026 19:23:00	La Luz primaria para todas las personas. Desarrolla las fuerzas autosanación. Sánate con la fuerza del Cristo de Dios. 7º capítulo: Aprende a escuchar el mensaje de tus órganos	La Luz primaria para todas las personas. Desarrolla las fuerzas autosanación. Sánate con la fuerza del Cristo de Dios. 7º capítulo: Aprende a escuchar el mensaje de tus órganos		False	False	False	False	False	False	False	ES_URLICHT_TITEL.jpg
1036	27606	InnererWeg 16	GR-IW	00:26:30	17.05.2026 20:24:00	Motivación para el Camino Interno - Resumen	El Camino interno hacia la Consciencia cósmica. Peldaño del Orden. Programa 16		False	False	False	False	False	False	False	IW_ES.jpg
1039	34111	Bergpredigt 08	LES	00:26:30	17.05.2026 20:56:30	El Sermón de la Montaña de Jesús de Nazaret. Parte 8	El Sermón de la Montaña de Jesús de Nazaret. Parte 8		False	False	False	False	False	False	False	Berg_ES-00.jpg
1045	47201	Christus Ostern26	OFF	00:27:30	17.05.2026 21:33:30	El Cristo de Dios se manifestó en la Comunidad base del Señor para la construcción del Reino de Paz del Cristo de Dios el Viernes Santo de 2026, el año 3 de la Era mesiánica, sofiánica	El Cristo de Dios se manifestó en la Comunidad base del Señor para la construcción del Reino de Paz del Cristo de Dios el Viernes Santo de 2026, el año 3 de la Era mesiánica, sofiánica		False	False	False	False	False	False	False	ES_OFFChristusOstern26.jpg
1047	07030	InnereLeben x	MED	00:12:00	17.05.2026 22:07:00	Meditación: La vida interna es el Espíritu	Meditación: La vida interna es el Espíritu		False	False	False	False	False	False	False	InnereLeben.jpg
1049	08333	JederAtemzug	MED	00:30:00	17.05.2026 22:19:30	Meditación: Cada respiración es presencia de Dios	Meditación: Cada respiración es presencia de Dios		False	False	False	False	False	False	False	JederAtemzug.jpg
1050	36882	10 Gebote 2	LES	00:20:30	17.05.2026 22:49:30	Los Diez Mandamientos de Dios.  Parte 2	Coloquio sobre: Los Diez Mandamientos de Dios expuestos con las palabras del tiempo actual. Parte 2		False	False	False	False	False	False	False	ZehnGebote.jpg
1052	35876	SchuleLeben 14	DWS	00:24:30	17.05.2026 23:13:00	Armonía es la vida de la empresa	La verdadera escuela es la vida. Horas de enseñanza dadas desde la Sabiduría divina.		False	False	False	False	False	False	False	DWSharmonieBetriebe.jpg
1055	41750	FGE VS Les 04 SieSindNiAllein	FGE	00:05:00	17.05.2026 23:47:00	Somos las colectividades libres - Une y sé (4) 	Usted no está sólo		False	False	False	False	False	False	False	ES_FGE_VerbindeUndSei.jpg