id	RsmmID	Titel	Serie	Länge	Sendezeit	Titel_Sprache	Beschreibung_Sprache	Block	MO	DI	MI	DO	FR	SA	SO	Bild
877	40689	SichSelbstFinden2 2KiZ	LIOS	00:12:30	19.04.2026 19:34:30	Liobani: Encontrar a si mesmo.	Liobani: Encontrar a si mesmo. A escola a para Nova Jerusalém para um tempo diferente no signo do Cristo de Deus, do amor a Deus e ao próximo		False	False	False	False	False	False	False	IchErzaehle.jpg
879	38610	Brache	DOK	00:18:00	19.04.2026 19:47:30	A nova agricultura para a nova era	O pousio - solo saudável, frutos saudáveis		False	False	False	False	False	False	False	BauenBruecke.jpg
882	47190	Ostern 2026	SON	01:03:30	19.04.2026 20:11:00	Celebração da Família de Deus na Terra	Cristo, o ressuscitado, veio por amor a toda a criação		False	False	False	False	False	False	False	PT_Ostern2026.jpg
885	27403	InnererWeg 15	GR-IW	00:25:00	19.04.2026 21:18:30	O Caminho Interior à Consciência Cósmica. Nivel Básico da Ordem. Parte 15	O Caminho Interior à Consciência Cósmica. Nivel Básico da Ordem. Parte 15		False	False	False	False	False	False	False	IW_PT.jpg
888	27790	Sternstunden 06	MED	00:30:00	19.04.2026 21:50:30	Horas estelares com Gabriele. Sê Silencioso - Deus Habita em Você. A renovação da vida que vem de dentro	Horas estelares com Gabriele. Sê Silencioso - Deus Habita em Você. A renovação da vida que vem de dentro		False	False	False	False	False	False	False	ÄsteMitSchneeSonne.jpg
894	44760	SchuleLeben 35	DWS	00:29:00	19.04.2026 22:26:00	A Verdadeira Escola é a Vida. Horas de Ensino a partir da sabedoria Divina: "A palavra serve como meio de comunicação. Por que falamos além dela?"	Por que falamos além dela?		False	False	False	False	False	False	False	Wörte.jpg
896	47070	Christus März26	OFF	00:18:30	19.04.2026 22:55:30	O Cristo de Deus deu uma revelação na Comunidade Central do Senhor para a edificação do Reino da Paz do Cristo de Deus em março de 2026, o 3. ano da era messiânica e sofiânica	O Cristo de Deus deu uma revelação na Comunidade Central do Senhor para a edificação do Reino da Paz do Cristo de Deus em março de 2026, o 3. ano da era messiânica e sofiânica		False	False	False	False	False	False	False	ChristusMärz26.jpg
898	47071	Gabriele März26	OFF	00:22:30	19.04.2026 23:18:30	O Serafim da Sabedoria Divina deu uma revelação na Comunidade Central do Senhor para a edificação do Reino da Paz do Cristo de Deus em março de 2026, o 3. ano da era messiânica e sofiânica	O Serafim da Sabedoria Divina deu uma revelação na Comunidade Central do Senhor para a edificação do Reino da Paz do Cristo de Deus em março de 2026, o 3. ano da era messiânica e sofiânica		False	False	False	False	False	False	False	GabrieleMärz26_3.jpg
900	41249	Klassik Seele 58e_17	KONZ1	00:16:30	19.04.2026 23:43:30	Música clásica para el alma. Konzert für Fagott und Orchester in d-moll BWV 1056 von J.S. Bach, Romanze aus Sinfonia Concertante in D-Dur für Violine, Viola und Orchester von C. Stamitz	Música clásica para el alma. Konzert für Fagott und Orchester in d-moll BWV 1056 von J.S. Bach, Romanze aus Sinfonia Concertante in D-Dur für Violine, Viola und Orchester von C. Stamitz		False	False	False	False	False	False	False	Konzerte.jpg