id	RsmmID	Titel	Serie	Länge	Sendezeit	Titel_Sprache	Beschreibung_Sprache	Block	MO	DI	MI	DO	FR	SA	SO	Bild
560	44877	GottVater Pfingsten25	OFF	00:39:00	17.04.2026 12:22:00	Deus-Pai revelou-se no encontro da Comunidade Cristã Original no Pentecostes, dia 7 de junho de 2025, na Comunidade do Senhor para a edificação do Reino da Paz do Cristo de Deus	Deus-Pai revelou-se no encontro da Comunidade Cristã Original no Pentecostes, dia 7 de junho de 2025, na Comunidade do Senhor para a edificação do Reino da Paz do Cristo de Deus		False	False	False	False	False	False	False	PT_OFF_Pfingsten.jpg
562	14054	Gabe Selbsthilfe	MED	00:23:00	17.04.2026 13:05:00	Meditacão: Una presente para Autoajuda	Meditacão: Una presente para Autoajuda		False	False	False	False	False	False	False	GabeSelbsthilfe.jpg
569	27403	InnererWeg 15	GR-IW	00:25:00	17.04.2026 13:32:00	O Caminho Interior à Consciência Cósmica. Nivel Básico da Ordem. Parte 15	O Caminho Interior à Consciência Cósmica. Nivel Básico da Ordem. Parte 15		False	False	False	False	False	False	False	IW_PT.jpg
574	42895	Urlicht 01	MED	00:56:30	17.04.2026 13:59:30	A Luz Primordial para todas as pessoas. Desenvolva as forças de auto-cura. Cure-se com o poder do Cristo de Deus. Parte 1: Ative as luz primordial, a força do Cristo de Deus na sua alma e no seu corpo  	A Luz Primordial para todas as pessoas. Desenvolva as forças de auto-cura. Cure-se com o poder do Cristo de Deus. Parte 1: Ative as luz primordial, a força do Cristo de Deus na sua alma e no seu corpo  		False	False	False	False	False	False	False	Organansprache.jpg
581	44190	LebenIstKlang 1KiZ	LIOS	00:17:00	17.04.2026 15:01:00	Liobani: A vida é som.	Liobani: A vida é som. A escola a para Nova Jerusalém para um tempo diferente no signo do Cristo de Deus, do amor a Deus e ao próximo		False	False	False	False	False	False	False	
586	47190	Ostern 2026	SON	01:03:30	17.04.2026 15:22:00	Celebração da Família de Deus na Terra	Cristo, o ressuscitado, veio por amor a toda a criação		False	False	False	False	False	False	False	PT_Ostern2026.jpg
589	37057	TodSchatten	SON	00:56:30	17.04.2026 16:30:30	Morte - Onde Estão as Suas Sombras?	Programa especial sobre o tema "Morte – Onde Estão as Suas Sombras?", dado da cornucopia da Sabedoria Divina em Novembro de 2021		False	False	False	False	False	False	False	TodSchatten_PT.jpg
592	27403	InnererWeg 15	GR-IW	00:25:00	17.04.2026 17:31:30	O Caminho Interior à Consciência Cósmica. Nivel Básico da Ordem. Parte 15	O Caminho Interior à Consciência Cósmica. Nivel Básico da Ordem. Parte 15		False	False	False	False	False	False	False	IW_PT.jpg
597	23429	DasIstMeinWort 04	LES	00:22:00	17.04.2026 17:59:30	Esta é a Minha Palavra, A e Ω. Capítulo 28: "Jesus liberta os animais"	Esta é a Minha Palavra, A e Ω. Capítulo 28: "Jesus liberta os animais"		False	False	False	False	False	False	False	zz UrlehreJesu.jpg
601	47070	Christus März26	OFF	00:18:30	17.04.2026 18:28:00	O Cristo de Deus deu uma revelação na Comunidade Central do Senhor para a edificação do Reino da Paz do Cristo de Deus em março de 2026, o 3. ano da era messiânica e sofiânica	O Cristo de Deus deu uma revelação na Comunidade Central do Senhor para a edificação do Reino da Paz do Cristo de Deus em março de 2026, o 3. ano da era messiânica e sofiânica		False	False	False	False	False	False	False	ChristusMärz26.jpg
603	47071	Gabriele März26	OFF	00:22:30	17.04.2026 18:50:30	O Serafim da Sabedoria Divina deu uma revelação na Comunidade Central do Senhor para a edificação do Reino da Paz do Cristo de Deus em março de 2026, o 3. ano da era messiânica e sofiânica	O Serafim da Sabedoria Divina deu uma revelação na Comunidade Central do Senhor para a edificação do Reino da Paz do Cristo de Deus em março de 2026, o 3. ano da era messiânica e sofiânica		False	False	False	False	False	False	False	GabrieleMärz26_3.jpg
606	40752	Männerwelt Teil 1	SON	01:14:00	17.04.2026 19:21:30	O Mundo dos Homens ontem e hoje. Os três atributos do Deus-Pai-Mãe e a capitulação do Satanista. Parte 1	O Mundo dos Homens ontem e hoje. Os três atributos do Deus-Pai-Mãe e a capitulação do Satanista. Parte 1		False	False	False	False	False	False	False	PT_Maenerwelt.jpg
613	40822	Zelt GottHeilt 01 WEB	LES-ZELT	00:26:00	17.04.2026 20:41:00	Uma leitura do livro "Deus Cura" de Gabriele. Parte 1. Desde o Arco da Aliança do Espírito Livre, desde a Tenda de Deus, a palavra eterna vem diretamente a nós	Uma leitura do livro "Deus Cura" de Gabriele. Parte 1. Desde o Arco da Aliança do Espírito Livre, desde a Tenda de Deus, a palavra eterna vem diretamente a nós		False	False	False	False	False	False	False	GottHeilt.jpg
615	40823	Zelt GottHeilt 02 WEB	LES-ZELT	00:19:00	17.04.2026 21:10:30	Uma leitura do livro "Deus Cura" de Gabriele. Parte 2. Desde o Arco da Aliança do Espírito Livre, desde a Tenda de Deus, a palavra eterna vem diretamente a nós	Uma leitura do livro "Deus Cura" de Gabriele. Parte 2. Desde o Arco da Aliança do Espírito Livre, desde a Tenda de Deus, a palavra eterna vem diretamente a nós		False	False	False	False	False	False	False	GottHeilt.jpg
618	47190	Ostern 2026	SON	01:03:30	17.04.2026 21:35:00	Celebração da Família de Deus na Terra	Cristo, o ressuscitado, veio por amor a toda a criação		False	False	False	False	False	False	False	PT_Ostern2026.jpg
621	47153	ChristusAuferstehen	MED	00:24:00	17.04.2026 22:44:30	Cristo deseja ressuscitar em cada um de nós	Meditação dada por Gabriele, a profetisa e emissária do Reino Eterno em 25 de março 2005		False	False	False	False	False	False	False	PT_MED_ChristusAuferstehung.jpg
624	42231	FGE VS Les 12 SieSindNiAllein2	FGE	00:06:00	17.04.2026 23:13:00	Nós somos as Comunidades Livres - Una e seja (12)	Você não está sozinho		False	False	False	False	False	False	False	PT_FGE-VS.jpg
631	27403	InnererWeg 15	GR-IW	00:25:00	17.04.2026 23:26:00	O Caminho Interior à Consciência Cósmica. Nivel Básico da Ordem. Parte 15	O Caminho Interior à Consciência Cósmica. Nivel Básico da Ordem. Parte 15		False	False	False	False	False	False	False	IW_PT.jpg
635	47153	ChristusAuferstehen	MED	00:24:00	18.04.2026 00:00:30	Cristo deseja ressuscitar em cada um de nós	Meditação dada por Gabriele, a profetisa e emissária do Reino Eterno em 25 de março 2005		False	False	False	False	False	False	False	PT_MED_ChristusAuferstehung.jpg
637	14713	Tierliebe Jesu	PAL	00:41:00	18.04.2026 00:27:00	O Amor de Jesus aos Animais, que Nos Foi Ocultado	O Amor de Jesus aos Animais, que Nos Foi Ocultado		False	False	False	False	False	False	False	TierliebeJesu.jpg
639	23213	Gottesliebe	MED	00:27:30	18.04.2026 01:11:00	O amor a Deus e ao próximo cura	O amor a Deus e ao próximo cura		False	False	False	False	False	False	False	Gottesliebe.jpg
641	42347	Gemeinschaften 12	FGE	00:14:00	18.04.2026 01:41:00	As Comunidades Livres Sob o Signo do Lírio. Tema: A vida é evolução	As Comunidades Livres Sob o Signo do Lírio. Tema: A vida é evolução		False	False	False	False	False	False	False	Herzensgebet.jpg
647	28683	InnereAndacht 06	MED	00:53:30	18.04.2026 02:07:00	Devocional Interior, 6ª Parte	A Oração Profunda Nos Dá a Experiencia do Silêncio Infinito e da Paz Interior”		False	False	False	False	False	False	False	InnereAndacht_PT_Neu.jpg
650	47190	Ostern 2026	SON	01:03:30	18.04.2026 03:11:00	Celebração da Família de Deus na Terra	Cristo, o ressuscitado, veio por amor a toda a criação		False	False	False	False	False	False	False	PT_Ostern2026.jpg
654	42972	UrchristenWeltwBeten kurz10 OAdr (Web)	SON	00:13:00	18.04.2026 04:23:30	Os Cristãos Originais unem-se em uma oração comum pela paz	Os Cristãos Originais unem-se em uma oração comum pela paz		False	False	False	False	False	False	False	FGE_OFF.jpg
657	45448	JesusKamFürTiere	LES	00:39:00	18.04.2026 04:39:00	Jesus de Nazaré também veio para os animais	Jesus de Nazaré também veio para os animais		False	False	False	False	False	False	False	BundGottTiere.jpg
662	27521	RufGabriele 8 WorteFÃ¼rDasLeben	SON	00:13:00	18.04.2026 05:26:30	A Chamada de Gabriele 08 - Palavras para a vida	A Chamada de Gabriele 08 - Palavras para a vida		False	False	False	False	False	False	False	Lilie.jpg
665	46887	FGE JugendOstern	FGE	00:28:00	18.04.2026 05:45:30	Comunidades livres internacionais de jovens em todo o mundo!	Comunidades livres internacionais de jovens em todo o mundo!		False	False	False	False	False	False	False	JugendInternational.jpg
667	14017	Es blueht Fr	MED	00:24:00	18.04.2026 06:17:30	Meditacão: Tudo floresce	Meditacão: Tudo floresce		False	False	False	False	False	False	False	EsBlueht.jpg
669	20868	Medikurs1 05	MED	00:25:00	18.04.2026 06:44:00	Meditação Cristã Oríginal - "Eu me dirijo ao Eterno Campo de energia do Amor"	Meditação Cristã Oríginal - "Eu me dirijo ao Eterno Campo de energia do Amor"		False	False	False	False	False	False	False	Medikurs.jpg
677	36892	10 Gebote 2	LES	00:20:30	18.04.2026 07:14:30	Os Dez Mandamentos de Deus	Os Dez Mandamentos de Deus - Interpredados com as palavras dos tempos de hoje. 2ª parte		False	False	False	False	False	False	False	PT_10GeboteTeil2.jpg
679	36923	10 Gebote 3	LES	00:18:00	18.04.2026 07:38:00	Os Dez Mandamentos de Deus	Os Dez Mandamentos de Deus - Interpredados com as palavras dos tempos de hoje. 3ª parte		False	False	False	False	False	False	False	PT_10GeboteTeil3.jpg
681	27521	RufGabriele 8 WorteFÃ¼rDasLeben	SON	00:13:00	18.04.2026 07:59:00	A Chamada de Gabriele 08 - Palavras para a vida	A Chamada de Gabriele 08 - Palavras para a vida		False	False	False	False	False	False	False	Lilie.jpg
684	27355	Sternstunden 05	MED	00:39:00	18.04.2026 08:14:30	Horas estelares com Gabriele. A  Alma Luminosa na Luz do Cristo de Deus	Horas estelares com Gabriele. A  Alma Luminosa na Luz do Cristo de Deus		False	False	False	False	False	False	False	Sternstunden05.jpg
688	14082	Zuversicht 2	MED	00:10:00	18.04.2026 09:01:30	Confiança: Um Ganho de Vida	Confiança: Um Ganho de Vida		False	False	False	False	False	False	False	Löwenzahn.jpg
690	25733	InnererWeg 00	GR-IW	00:39:30	18.04.2026 09:13:30	A Chamada de Gabriele, a Profetisa e Enviada de Deus, na Idade Messiânica, Sophiânica do Lírio, do Amor a Deus e ao Próximo	A Chamada de Gabriele, a Profetisa e Enviada de Deus, na Idade Messiânica, Sophiânica do Lírio, do Amor a Deus e ao Próximo		False	False	False	False	False	False	False	Ruf-2.jpg
692	20868	Medikurs1 05	MED	00:25:00	18.04.2026 09:53:30	Meditação Cristã Oríginal - "Eu me dirijo ao Eterno Campo de energia do Amor"	Meditação Cristã Oríginal - "Eu me dirijo ao Eterno Campo de energia do Amor"		False	False	False	False	False	False	False	Medikurs.jpg
696	47190	Ostern 2026	SON	01:03:30	18.04.2026 10:29:00	Celebração da Família de Deus na Terra	Cristo, o ressuscitado, veio por amor a toda a criação		False	False	False	False	False	False	False	PT_Ostern2026.jpg
698	14076	ErlebeDieEinheit	MED	00:19:00	18.04.2026 11:36:30	Meditacão: Alcance a experiencia de Deus	Meditacão: Alcance a experiencia de Deus		False	False	False	False	False	False	False	ErlebeDieEinheit.jpg
700	42723	UnsereHeimat	MED	00:33:30	18.04.2026 12:00:00	Meditação. A Nossa Pátria no SER Puro	Meditação. A Nossa Pátria no SER Puro		False	False	False	False	False	False	False	PT_UnsereHeimat.jpg
703	41589	FGE Rückmeldungen 03	FGE	00:16:00	18.04.2026 12:38:30	Nos lemos... Você nos escuta? Ter empatia, vivenciar... Jovens a caminho de Cristo (03)	Nos lemos... Você nos escuta? Ter empatia, vivenciar... Jovens a caminho de Cristo (03)		False	False	False	False	False	False	False	PT_FGE_RueckmeldungJung.jpg
705	27403	InnererWeg 15	GR-IW	00:25:00	18.04.2026 12:59:30	O Caminho Interior à Consciência Cósmica. Nivel Básico da Ordem. Parte 15	O Caminho Interior à Consciência Cósmica. Nivel Básico da Ordem. Parte 15		False	False	False	False	False	False	False	IW_PT.jpg
707	20868	Medikurs1 05	MED	00:25:00	18.04.2026 13:29:30	Meditação Cristã Oríginal - "Eu me dirijo ao Eterno Campo de energia do Amor"	Meditação Cristã Oríginal - "Eu me dirijo ao Eterno Campo de energia do Amor"		False	False	False	False	False	False	False	Medikurs.jpg
715	47190	Ostern 2026	SON	01:03:30	18.04.2026 14:00:30	Celebração da Família de Deus na Terra	Cristo, o ressuscitado, veio por amor a toda a criação		False	False	False	False	False	False	False	PT_Ostern2026.jpg
722	33157	JugendProphet 01	LES	00:25:00	18.04.2026 15:12:30	O jovem e o profeta. Parte 1	O jovem e o profeta. Parte 1		False	False	False	False	False	False	False	LiobaniJugend.jpg
724	46887	FGE JugendOstern	FGE	00:28:00	18.04.2026 15:42:30	Comunidades livres internacionais de jovens em todo o mundo!	Comunidades livres internacionais de jovens em todo o mundo!		False	False	False	False	False	False	False	JugendInternational.jpg
726	45448	JesusKamFürTiere	LES	00:39:00	18.04.2026 16:12:30	Jesus de Nazaré também veio para os animais	Jesus de Nazaré também veio para os animais		False	False	False	False	False	False	False	BundGottTiere.jpg
732	14017	Es blueht Fr	MED	00:24:00	18.04.2026 17:02:30	Meditacão: Tudo floresce	Meditacão: Tudo floresce		False	False	False	False	False	False	False	EsBlueht.jpg
735	43157	FGE VS Les 21 WorteDesLebens	FGE	00:07:30	18.04.2026 17:35:30	Nós somos as Comunidades Livres - Una e seja (21)	Palavras de Vida 1		False	False	False	False	False	False	False	PT_FGE-VS.jpg
737	34104	ChristusErlösung	MED	00:22:30	18.04.2026 17:44:00	Meditação de Oração. Cristo é Redenção em Nós	Meditação de Oração. Cristo é Redenção em Nós		False	False	False	False	False	False	False	EN_CH92ChristusErloesung.jpg
740	43840	Gemeinschaften 13	FGE	00:15:30	18.04.2026 18:14:00	As Comunidades Livres Sob o Signo do Lírio. Tema: "Onde Quer Que Estejam Reunidos"	As Comunidades Livres Sob o Signo do Lírio. Tema: "Onde Quer Que Estejam Reunidos"		False	False	False	False	False	False	False	PT_FGE_13.jpg
743	46887	FGE JugendOstern	FGE	00:28:00	18.04.2026 18:34:30	Comunidades livres internacionais de jovens em todo o mundo!	Comunidades livres internacionais de jovens em todo o mundo!		False	False	False	False	False	False	False	JugendInternational.jpg
748	28623	InnereAndacht 05	MED	00:55:30	18.04.2026 19:12:00	Devocional Interior, 5ª Parte	Deus É o Todo em Tudo - Indivisível		False	False	False	False	False	False	False	InnereAndacht_PT_Neu.jpg
750	46879	GottVater Feb26	OFF	00:36:00	18.04.2026 20:10:00	Deus-Pai se revelou na Comunidade Central do Senhor para a edificação do Reino da Paz do Cristo de Deus em fevereiro de 2026, o terceiro ano da Era Messiânica e Sofiânica	Deus-Pai se revelou na Comunidade Central do Senhor para a edificação do Reino da Paz do Cristo de Deus em fevereiro de 2026, o terceiro ano da Era Messiânica e Sofiânica		False	False	False	False	False	False	False	CHFeuerSchüssel.jpg
753	39860	IchKommeBald1 WEB	LES	01:25:00	18.04.2026 20:50:00	A Idade Messiânica Sofiânica. Eu Logo Venho! Eu Sou o Cristo de Deus	A Idade Messiânica Sofiânica. Eu Logo Venho! Eu Sou o Cristo de Deus		False	False	False	False	False	False	False	Band.jpg
755	29959	Klassik Seele 52A_36	KONZ1	00:35:30	18.04.2026 22:17:00	Classics for the Soul. Santec Music Orchestra	Clair de lune von C. Debussy, Klavierkonzert Nr. 21 von W.A. Mozart (Jul. 2016)		False	False	False	False	False	False	False	KlassikSeele.jpg
756	47190	Ostern 2026	SON	01:03:30	18.04.2026 22:52:30	Celebração da Família de Deus na Terra	Cristo, o ressuscitado, veio por amor a toda a criação		False	False	False	False	False	False	False	PT_Ostern2026.jpg
758	43522	AuflösungFormen 2	SON	00:52:30	19.04.2026 00:00:30	Parte 2. Os preparativos para a dissolução de todas as formas condensadas e o retorno do Cristo de Deus. 	2a Parte: O significado do Ato Redentor do Cristo de Deus e o fim da Queda		False	False	False	False	False	False	False	PT_Aufloesung.jpg
761	14081	Zuversicht 1	MED	00:11:00	19.04.2026 00:57:30	Confiança: Ganhar a Vida Elevada	Confiança: Ganhar a Vida Elevada		False	False	False	False	False	False	False	BabyMutterHände.jpg
763	14044	ChristusErfahren	MED	00:26:00	19.04.2026 01:09:30	Meditação: Cristo Cura "Vivenciar a Cristo em nós"	Meditação: Cristo Cura "Vivenciar a Cristo em nós"		False	False	False	False	False	False	False	zz BotschaftAusDemAll-02.jpg
767	35396	BotschaftAusDemAll 05	LES	00:24:30	19.04.2026 01:40:00	O Reino Eterno: "Use o tempo precioso!" Uma leitura de uma revelação do Cristo de Deus dada através de Gabriele, a profetisa e emissária do Reino Eterno, no dia 4 de março de 1988 em Würzburg, Alemanha	Leitura de uma revelação do Cristo de Deus "Use o Tempo Precioso", dado através de Gabriele, a profetisa e emissária do Reino Eterno, no dia 4 de março de 1988 em Würzburg, Alemanha.		False	False	False	False	False	False	False	ChristusErlösung.jpg
770	42055	FGE VS Les 10 ErfülltesLeben	FGE	00:06:30	19.04.2026 02:11:00	Nós somos as Comunidades Livres - Una e seja (10)	Uma vida plena até a velhice		False	False	False	False	False	False	False	PT_FGE-VS.jpg
773	42053	FGE VS Les 08 DuDasTier	FGE	00:07:00	19.04.2026 02:22:00	Nós somos as Comunidades Livres - Una e seja (8)	Você, o animal. Você o ser humano. Quem tem valores mais elevados?		False	False	False	False	False	False	False	PT_FGE-VS.jpg
775	27403	InnererWeg 15	GR-IW	00:25:00	19.04.2026 02:31:00	O Caminho Interior à Consciência Cósmica. Nivel Básico da Ordem. Parte 15	O Caminho Interior à Consciência Cósmica. Nivel Básico da Ordem. Parte 15		False	False	False	False	False	False	False	IW_PT.jpg
777	35405	SchuleLeben 07	DWS	00:50:00	19.04.2026 02:59:00	A Verdadeira Escola é a Vida. Horas de Ensino a partir da sabedoria Divina: "Bem-estar e vivir feliz. Cada dia pode ser um ganho na vida"	A Verdadeira Escola é a Vida. Horas de Ensino a partir da sabedoria Divina: "Bem-estar e vivir feliz. Cada dia pode ser um ganho na vida"		False	False	False	False	False	False	False	DieWahreSchule.jpg
782	36980	Die neue Landwirtschaft	GR-SON	00:32:30	19.04.2026 03:52:00	A nova agricultura sob o signo da Terra-Isaías messiânica, sofiânica na obra de ação do amor a Deus e ao próximo	A nova agricultura sob o signo da Terra-Isaías messiânica, sofiânica na obra de ação do amor a Deus e ao próximo		False	False	False	False	False	False	False	SchmetterlingUndGetreide_korr.jpg
789	33158	BotschaftAusDemAll 01	LES	00:38:30	19.04.2026 04:31:00	O Reino Eterno "Ou Por Mim ou Contra Mim" Uma leitura de uma revelação do Cristo de Deus dada através de Gabriele, a profetisa e emissária de Deus no dia 14 Junho de 1980 na cidade de Augsburg, Alemanha	O Reino Eterno "Ou Por Mim ou Contra Mim" Uma leitura de uma revelação do Cristo de Deus dada através de Gabriele, a profetisa e emissária de Deus no dia 14 Junho de 1980 na cidade de Augsburg, Alemanha		False	False	False	False	False	False	False	ZellOFFBd.jpg
794	30752	InnereAndacht 18	MED	01:00:00	19.04.2026 05:14:30	Devocional Interior, 18ª Parte 	Em tudo há sempre o todo - mesmo nas menores coisas		False	False	False	False	False	False	False	PT_InnereAndacht18_bearb.jpg
796	42351	FGE VS Les 20 ErfülltesLeben2	FGE	00:07:30	19.04.2026 06:18:00	Nós somos as Comunidades Livres - Una e seja (20)	Uma vida plena até a velhice 2		False	False	False	False	False	False	False	PT_FGE-VS.jpg
798	33678	Bergpredigt 02	LES	00:24:00	19.04.2026 06:26:30	O Sermão da Montanha de Jesus de Nazaré. Parte 2	O Sermão da Montanha de Jesus de Nazaré. Parte 2		False	False	False	False	False	False	False	Berg_PT-00.jpg
803	28552	Gemeinschaften 05	FGE	00:19:00	19.04.2026 06:53:00	As Comunidades Livres Sob o Signo do Lírio. Tema: Nós somos seres da lei do universo	As Comunidades Livres Sob o Signo do Lírio. Tema: Nós somos seres da lei do universo		False	False	False	False	False	False	False	Lilie.jpg
806	47190	Ostern 2026	SON	01:03:30	19.04.2026 07:18:00	Celebração da Família de Deus na Terra	Cristo, o ressuscitado, veio por amor a toda a criação		False	False	False	False	False	False	False	PT_Ostern2026.jpg
809	35246	SchuleLeben 01	DWS	00:21:30	19.04.2026 08:30:00	A Verdadeira Escola é a Vida. Horas de Ensino a partir da sabedoria Divina: "Mantenha a calma interior em todas as situações"	A Verdadeira Escola é a Vida. Horas de Ensino a partir da sabedoria Divina: "Mantenha a calma interior em todas as situações"		False	False	False	False	False	False	False	DWS-PT_01.jpg
812	37057	TodSchatten	SON	00:56:30	19.04.2026 08:54:30	Morte - Onde Estão as Suas Sombras?	Programa especial sobre o tema "Morte – Onde Estão as Suas Sombras?", dado da cornucopia da Sabedoria Divina em Novembro de 2021		False	False	False	False	False	False	False	TodSchatten_PT.jpg
815	27403	InnererWeg 15	GR-IW	00:25:00	19.04.2026 09:55:30	O Caminho Interior à Consciência Cósmica. Nivel Básico da Ordem. Parte 15	O Caminho Interior à Consciência Cósmica. Nivel Básico da Ordem. Parte 15		False	False	False	False	False	False	False	IW_PT.jpg
820	23311	DasIstMeinWort 01	LES	00:23:00	19.04.2026 10:23:30	Esta é a Minha Palavra, A e Ω. Capítulo 38: "Acerca de matar animais"	Esta é a Minha Palavra, A e Ω. Capítulo 38: "Acerca de matar animais"		False	False	False	False	False	False	False	AmSeeufer.jpg
823	23429	DasIstMeinWort 04	LES	00:22:00	19.04.2026 10:54:30	Esta é a Minha Palavra, A e Ω. Capítulo 28: "Jesus liberta os animais"	Esta é a Minha Palavra, A e Ω. Capítulo 28: "Jesus liberta os animais"		False	False	False	False	False	False	False	zz UrlehreJesu.jpg
827	47070	Christus März26	OFF	00:18:30	19.04.2026 11:23:00	O Cristo de Deus deu uma revelação na Comunidade Central do Senhor para a edificação do Reino da Paz do Cristo de Deus em março de 2026, o 3. ano da era messiânica e sofiânica	O Cristo de Deus deu uma revelação na Comunidade Central do Senhor para a edificação do Reino da Paz do Cristo de Deus em março de 2026, o 3. ano da era messiânica e sofiânica		False	False	False	False	False	False	False	ChristusMärz26.jpg
829	47071	Gabriele März26	OFF	00:22:30	19.04.2026 11:45:30	O Serafim da Sabedoria Divina deu uma revelação na Comunidade Central do Senhor para a edificação do Reino da Paz do Cristo de Deus em março de 2026, o 3. ano da era messiânica e sofiânica	O Serafim da Sabedoria Divina deu uma revelação na Comunidade Central do Senhor para a edificação do Reino da Paz do Cristo de Deus em março de 2026, o 3. ano da era messiânica e sofiânica		False	False	False	False	False	False	False	GabrieleMärz26_3.jpg
832	40752	Männerwelt Teil 1	SON	01:14:00	19.04.2026 12:16:30	O Mundo dos Homens ontem e hoje. Os três atributos do Deus-Pai-Mãe e a capitulação do Satanista. Parte 1	O Mundo dos Homens ontem e hoje. Os três atributos do Deus-Pai-Mãe e a capitulação do Satanista. Parte 1		False	False	False	False	False	False	False	PT_Maenerwelt.jpg
838	40822	Zelt GottHeilt 01 WEB	LES-ZELT	00:26:00	19.04.2026 13:35:30	Uma leitura do livro "Deus Cura" de Gabriele. Parte 1. Desde o Arco da Aliança do Espírito Livre, desde a Tenda de Deus, a palavra eterna vem diretamente a nós	Uma leitura do livro "Deus Cura" de Gabriele. Parte 1. Desde o Arco da Aliança do Espírito Livre, desde a Tenda de Deus, a palavra eterna vem diretamente a nós		False	False	False	False	False	False	False	GottHeilt.jpg
840	40823	Zelt GottHeilt 02 WEB	LES-ZELT	00:19:00	19.04.2026 14:05:00	Uma leitura do livro "Deus Cura" de Gabriele. Parte 2. Desde o Arco da Aliança do Espírito Livre, desde a Tenda de Deus, a palavra eterna vem diretamente a nós	Uma leitura do livro "Deus Cura" de Gabriele. Parte 2. Desde o Arco da Aliança do Espírito Livre, desde a Tenda de Deus, a palavra eterna vem diretamente a nós		False	False	False	False	False	False	False	GottHeilt.jpg
843	47190	Ostern 2026	SON	01:03:30	19.04.2026 14:29:30	Celebração da Família de Deus na Terra	Cristo, o ressuscitado, veio por amor a toda a criação		False	False	False	False	False	False	False	PT_Ostern2026.jpg
848	42231	FGE VS Les 12 SieSindNiAllein2	FGE	00:06:00	19.04.2026 15:44:00	Nós somos as Comunidades Livres - Una e seja (12)	Você não está sozinho		False	False	False	False	False	False	False	PT_FGE-VS.jpg
854	27403	InnererWeg 15	GR-IW	00:25:00	19.04.2026 15:55:30	O Caminho Interior à Consciência Cósmica. Nivel Básico da Ordem. Parte 15	O Caminho Interior à Consciência Cósmica. Nivel Básico da Ordem. Parte 15		False	False	False	False	False	False	False	IW_PT.jpg
859	47177	GottVater Ostern25	OFF	00:27:00	19.04.2026 16:32:30	Deus-Pai deu uma revelação na Comunidade Central do Senhor para a edificação do Reino da Paz do Cristo de Deus na Páscoa de 2025, o 2. ano da Era Messiânica e Sofiânica	Deus-Pai deu uma revelação na Comunidade Central do Senhor para a edificação do Reino da Paz do Cristo de Deus na Páscoa de 2025, o 2. ano da Era Messiânica e Sofiânica		False	False	False	False	False	False	False	OFF_GottVaterOstern25.jpg
861	40415	ImGespräch 10	GR	00:57:30	19.04.2026 17:02:30	Em Conversa com... Peter Berthold, Professor de Ornitologia, sobre o assunto: "Salvar a biodiversidade - como?"	Em Conversa com... Peter Berthold, Professor de Ornitologia, sobre o assunto: "Salvar a biodiversidade - como?"		False	False	False	False	False	False	False	ImGesprächMit10.jpg
868	28518	InnereAndacht 03	MED	00:55:30	19.04.2026 18:08:00	Devocional Interior, 3ª Parte	Uma Nova Humanidade em Cristo Emerge		False	False	False	False	False	False	False	InnereAndacht_PT_Neu.jpg
871	33930	Bergpredigt 06	LES	00:23:30	19.04.2026 19:07:00	O Sermão da Montanha de Jesus de Nazaré. Parte 6	O Sermão da Montanha de Jesus de Nazaré. Parte 6		False	False	False	False	False	False	False	Berg_PT-00.jpg
