id	RsmmID	Titel	Serie	Länge	Sendezeit	Titel_Sprache	Beschreibung_Sprache	Block	MO	DI	MI	DO	FR	SA	SO	Bild
887	32362	Sternstunden 18	MED	00:35:00	10.05.2026 20:33:30	Horas estelares com Gabriele. O Primeiro e o Quinto Mandamento de Deus na Luz de Cristo	Horas estelares com Gabriele. O Primeiro e o Quinto Mandamento de Deus na Luz de Cristo		False	False	False	False	False	False	False	10Gebote.jpg
894	14084	Zuversicht 4	MED	00:21:00	10.05.2026 21:15:00	Confiança: Se queremos mudar o mundo, temos que mudar a nós mesmos	Confiança: Se queremos mudar o mundo, temos que mudar a nós mesmos		False	False	False	False	False	False	False	Zuversicht.jpg
900	35321	SchuleLeben 03	DWS	00:17:00	10.05.2026 21:41:00	A Verdadeira Escola é a Vida. Horas de Ensino a partir da sabedoria Divina:	A Verdadeira Escola é a Vida. Horas de Ensino a partir da sabedoria Divina: "Quando o filme da vida rebobinar"		False	False	False	False	False	False	False	DWS-PT_00B.jpg
909	46605	Christus Weihnachten25	OFF	00:30:00	10.05.2026 22:13:30	O Cristo de Deus revela-se Na Comunidade Central do Senhor Para a vinda do Cristo de Deus	Em 24 de dezembro de 2025, o ano 2 da Era Messiânica e Sofiânica		False	False	False	False	False	False	False	4000-Jahre.jpg
912	47190	Ostern 2026	SON	01:03:30	10.05.2026 22:50:00	Celebração da Família de Deus na Terra	Cristo, o ressuscitado, veio por amor a toda a criação		False	False	False	False	False	False	False	PT_Ostern2026.jpg