id	RsmmID	Titel	Serie	Länge	Sendezeit	Titel_Sprache	Beschreibung_Sprache	Block	MO	DI	MI	DO	FR	SA	SO	Bild
599	41793	SchuleLeben 30	DWS	00:28:30	08.05.2026 13:04:00	A Verdadeira Escola é a Vida. Horas de Ensino a partir da sabedoria Divina: "Liberdade,Unidade e o Amor de Deus"	A Verdadeira Escola é a Vida. Horas de Ensino a partir da sabedoria Divina: "Liberdade,Unidade e o Amor de Deus"		False	False	False	False	False	False	False	PT_DWS30.jpg
605	37057	TodSchatten	SON	00:56:30	08.05.2026 13:36:30	Morte - Onde Estão as Suas Sombras?	Programa especial sobre o tema "Morte – Onde Estão as Suas Sombras?", dado da cornucopia da Sabedoria Divina em Novembro de 2021		False	False	False	False	False	False	False	TodSchatten_PT.jpg
608	41960	Lilienzeitalte 4Entwicklungseb. Teil 1 WEB	LES	00:55:30	08.05.2026 14:39:30	A Idade do Lírio, Sofia, a Sabedoria de Deus. Os Quatro planos de Desenvolvimento, o Berço da Evolução para a Filiação de Deus. Parte 1	A Idade do Lírio, Sofia, a Sabedoria de Deus. Os Quatro planos de Desenvolvimento, o Berço da Evolução para a Filiação de Deus. Parte 1		False	False	False	False	False	False	False	DuSollstNichtToeten.jpg
612	46887	FGE JugendOstern	FGE	00:28:00	08.05.2026 15:41:00	Comunidades livres internacionais de jovens em todo o mundo!	Comunidades livres internacionais de jovens em todo o mundo!		False	False	False	False	False	False	False	JugendInternational.jpg
615	44190	LebenIstKlang 1KiZ	LIOS	00:17:00	08.05.2026 16:12:30	Liobani: A vida é som.	Liobani: A vida é som. A escola a para Nova Jerusalém para um tempo diferente no signo do Cristo de Deus, do amor a Deus e ao próximo		False	False	False	False	False	False	False	LiobaniZeichnungVoegel.jpg
617	20947	Medikurs1 08	MED	00:33:00	08.05.2026 16:30:00	Meditação Cristã Oríginal - As Forças Divinas da Luz em Mim Transformam Tudo	Meditação Cristã Oríginal - As Forças Divinas da Luz em Mim Transformam Tudo		False	False	False	False	False	False	False	Medikurs.jpg
619	29234	InnereAndacht 12	MED	00:59:00	08.05.2026 17:05:00	Devocional Interior, 12ª Parte	Repouse em você - você é		False	False	False	False	False	False	False	PT_InnereAndacht_TextAmAnfang.jpg
623	27607	InnererWeg 16	GR-IW	00:28:30	08.05.2026 18:11:00	O Caminho Interior à Consciência Cósmica. Nivel Básico da Ordem. Parte 16	O Caminho Interior à Consciência Cósmica. Nivel Básico da Ordem. Parte 16		False	False	False	False	False	False	False	IW_PT.jpg
628	23725	DasIstMeinWort 09	LES	00:27:00	08.05.2026 18:42:30	Esta é a Minha Palavra, A e Ω. Capítulo 6: "Infância e Juventude de Jesus"	Esta é a Minha Palavra, A e Ω. Capítulo 6: "Infância e Juventude de Jesus"		False	False	False	False	False	False	False	PT_DasIStMeinWort2.jpg
630	23937	DasIstMeinWort 17	LES	00:16:30	08.05.2026 19:13:30	Esta é a Minha Palavra, A e Ω. Capítulo 60: "Sobre o pesar"	Esta é a Minha Palavra, A e Ω. Capítulo 60: "Sobre o pesar"		False	False	False	False	False	False	False	Freiheit.jpg
632	29234	InnereAndacht 12	MED	00:59:00	08.05.2026 19:37:00	Devocional Interior, 12ª Parte	Repouse em você - você é		False	False	False	False	False	False	False	PT_InnereAndacht_TextAmAnfang.jpg
638	41013	Zelt GottHeilt 07 WEB	LES-ZELT	00:28:30	08.05.2026 20:39:30	Uma leitura do livro "Deus Cura" de Gabriele. Parte 7. Desde o Arco da Aliança do Espírito Livre, desde a Tenda de Deus, a palavra eterna vem diretamente a nós	Uma leitura do livro "Deus Cura" de Gabriele. Parte 7. Desde o Arco da Aliança do Espírito Livre, desde a Tenda de Deus, a palavra eterna vem diretamente a nós		False	False	False	False	False	False	False	GottHeilt.jpg
641	42723	UnsereHeimat	MED	00:33:30	08.05.2026 21:14:00	Meditação. A Nossa Pátria no SER Puro	Meditação. A Nossa Pátria no SER Puro		False	False	False	False	False	False	False	PT_UnsereHeimat.jpg
644	42348	FGE VS Les 17 Liobani	FGE	00:06:30	08.05.2026 21:52:00	Nós somos as Comunidades Livres - Una e seja (17)	Liobani		False	False	False	False	False	False	False	PT_FGE-VS.jpg
647	42349	FGE VS Les 18 GroKosLehren	FGE	00:08:00	08.05.2026 22:02:00	Nós somos as Comunidades Livres - Una e seja (18)	Nós somos as Comunidades Livres - Una e seja (18)		False	False	False	False	False	False	False	PT_FGE-VS.jpg
652	27607	InnererWeg 16	GR-IW	00:28:30	08.05.2026 22:13:00	O Caminho Interior à Consciência Cósmica. Nivel Básico da Ordem. Parte 16	O Caminho Interior à Consciência Cósmica. Nivel Básico da Ordem. Parte 16		False	False	False	False	False	False	False	IW_PT.jpg
654	40752	Männerwelt Teil 1	SON	01:14:00	08.05.2026 22:45:00	O Mundo dos Homens ontem e hoje. Os três atributos do Deus-Pai-Mãe e a capitulação do Satanista. Parte 1	O Mundo dos Homens ontem e hoje. Os três atributos do Deus-Pai-Mãe e a capitulação do Satanista. Parte 1		False	False	False	False	False	False	False	PT_Maenerwelt.jpg
657	29977	InnereAndacht 16	MED	00:54:00	09.05.2026 00:00:30	Devocional Interior, 16ª Parte	O silêncio é a verdadeira vida		False	False	False	False	False	False	False	PT_InnereAndacht_16.jpg
658	22540	Klassik Seele 46d_18	KONZ1	00:17:30	09.05.2026 00:54:30	Classics for the Soul. Santec Music Orchestra	Classics for the Soul - Allegro from Symphony No. 6 in C major D589 by Franz Schubert (Apr. 2015)		False	False	False	False	False	False	False	KlassikSeele.jpg
660	28551	Gemeinschaften 04	FGE	00:26:00	09.05.2026 01:14:30	As Comunidades Livres Sob o Signo do Lírio. Tema: Quem é vocè? Sim, Quem somos nós?	As Comunidades Livres Sob o Signo do Lírio. Tema: Quem é vocè? Sim, Quem somos nós?		False	False	False	False	False	False	False	Lilie.jpg
663	39327	Herzensgebete	MED	00:13:00	09.05.2026 01:45:30	Meditação de Oração	Orações de coração são nutrimento para a alma		False	False	False	False	False	False	False	PT_Herzensgebete.jpg
666	28518	InnereAndacht 03	MED	00:55:30	09.05.2026 02:05:00	Devocional Interior, 3ª Parte	Uma Nova Humanidade em Cristo Emerge		False	False	False	False	False	False	False	InnereAndacht_PT_Neu.jpg
669	45345	Christus Nov25	OFF	00:22:30	09.05.2026 03:04:30	Revela-Se o Cristo de Deus durante o Encontro da Comunidade Central do Senhor para a Vinda do Cristo de Deus	No dia 8 de nevombro, ano 2 da Era Messiânica e Sofiânica		False	False	False	False	False	False	False	ChristusAbbildUndTische.jpg
671	40967	Tatglaube	MED	00:37:30	09.05.2026 03:30:30	Meditação de Cura. A fé ativa	Meditação de Cura. A fé ativa		False	False	False	False	False	False	False	CH60MitChristusBeten.jpg
673	46887	FGE JugendOstern	FGE	00:28:00	09.05.2026 04:10:30	Comunidades livres internacionais de jovens em todo o mundo!	Comunidades livres internacionais de jovens em todo o mundo!		False	False	False	False	False	False	False	JugendInternational.jpg
677	47190	Ostern 2026	SON	01:03:30	09.05.2026 04:48:30	Celebração da Família de Deus na Terra	Cristo, o ressuscitado, veio por amor a toda a criação		False	False	False	False	False	False	False	PT_Ostern2026.jpg
681	40731	Zellenstaat NEU	MED	00:26:00	09.05.2026 06:04:30	Meditação. O Estado Celular	Meditação. O Estado Celular		False	False	False	False	False	False	False	Zellenstaat.jpg
684	43197	ErlangeGotteserfahrung	MED	00:19:30	09.05.2026 06:41:30	Meditação. Alcance a experiencia de Deus	Meditação. Alcance a experiencia de Deus		False	False	False	False	False	False	False	PT_MED_ErlangeGottesErfahrung.jpg
686	20947	Medikurs1 08	MED	00:33:00	09.05.2026 07:04:30	Meditação Cristã Oríginal - As Forças Divinas da Luz em Mim Transformam Tudo	Meditação Cristã Oríginal - As Forças Divinas da Luz em Mim Transformam Tudo		False	False	False	False	False	False	False	Medikurs.jpg
694	41831	EwigeWortErde 03	SON	00:37:30	09.05.2026 07:44:30	A Palavra Eterna é transmitida na rádio e na televisão Ao redor de toda a Terra. 3	A Palavra Eterna Circula por Toda a Terra. Lido e repeitado internacionalmente: Cristianismo Original em todo o mundo. Parte 3		False	False	False	False	False	False	False	PT_EwigeWortErde3.jpg
696	42234	FGE VS Les 15 Lebensperlen2	FGE	00:06:30	09.05.2026 08:27:00	Nós somos as Comunidades Livres - Una e seja (15)	Pérolas da vida para você		False	False	False	False	False	False	False	PT_FGE-VS.jpg
698	35382	SchuleLeben 06	DWS	00:46:30	09.05.2026 08:34:30	A Verdadeira Escola é a Vida. Horas de Ensino a partir da sabedoria Divina: "Aprenda a conviver com a natureza e os animais, e assim, você aprende a compreender melhor a si mismo e também aos seus próximos"	A Verdadeira Escola é a Vida. Horas de Ensino a partir da sabedoria Divina: "Aprenda a conviver com a natureza e os animais, e assim, você aprende a compreender melhor a si mismo e também aos seus próximos"		False	False	False	False	False	False	False	DWS-PT_00B.jpg
700	41756	FGE VS Les 04 SieSindNiAllein	FGE	00:05:00	09.05.2026 09:24:00	Nós somos as Comunidades Livres - Una e seja (4)	Você não está sózinho		False	False	False	False	False	False	False	PT_FGE-VS.jpg
702	20947	Medikurs1 08	MED	00:33:00	09.05.2026 09:30:00	Meditação Cristã Oríginal - As Forças Divinas da Luz em Mim Transformam Tudo	Meditação Cristã Oríginal - As Forças Divinas da Luz em Mim Transformam Tudo		False	False	False	False	False	False	False	Medikurs.jpg
704	45344	Christus Okt25	OFF	00:32:00	09.05.2026 10:05:00	O Cristo de Deus se revelou na Comunidade Central do Senhor para a edificação do Reino da Paz do Cristo de Deus	Em 3 de outubro de 2025, ano 2 da Era Messiânica e Sofiânica		False	False	False	False	False	False	False	ChristusAbbildZelt.jpg
706	39327	Herzensgebete	MED	00:13:00	09.05.2026 10:42:30	Meditação de Oração	Orações de coração são nutrimento para a alma		False	False	False	False	False	False	False	PT_Herzensgebete.jpg
708	43522	AuflösungFormen 2	SON	00:52:30	09.05.2026 11:00:00	Parte 2. Os preparativos para a dissolução de todas as formas condensadas e o retorno do Cristo de Deus. 	2a Parte: O significado do Ato Redentor do Cristo de Deus e o fim da Queda		False	False	False	False	False	False	False	PT_Aufloesung.jpg
712	35223	Auferstehungslicht	MED	00:38:00	09.05.2026 12:00:30	Meditação de Oração. Cristo, a Luz de Resurreição, brilha na Nossa Alma.	Meditação de Oração. Cristo, a Luz de Resurreição, brilha na Nossa Alma.		False	False	False	False	False	False	False	Auferstehungslicht.jpg
714	26305	RufGabriele 3 Stillstand	SON	00:16:00	09.05.2026 12:40:30	A Chamada de Gabriele 03 - A vida não conhece nenhuma paralisação	A Chamada de Gabriele 03 - A vida não conhece nenhuma paralisação		False	False	False	False	False	False	False	Lilie.jpg
716	27607	InnererWeg 16	GR-IW	00:28:30	09.05.2026 13:00:30	O Caminho Interior à Consciência Cósmica. Nivel Básico da Ordem. Parte 16	O Caminho Interior à Consciência Cósmica. Nivel Básico da Ordem. Parte 16		False	False	False	False	False	False	False	IW_PT.jpg
718	20947	Medikurs1 08	MED	00:33:00	09.05.2026 13:31:00	Meditação Cristã Oríginal - As Forças Divinas da Luz em Mim Transformam Tudo	Meditação Cristã Oríginal - As Forças Divinas da Luz em Mim Transformam Tudo		False	False	False	False	False	False	False	Medikurs.jpg
725	14925	Planeten 4	FILM	00:52:00	09.05.2026 14:10:30	O planeta Terra:  A formosura da terra e a campanha do homem contra a vida	O planeta Terra:  A formosura da terra e a campanha do homem contra a vida		False	False	False	False	False	False	False	Planeten-4.jpg
730	35880	SchuleLeben 14	DWS	00:24:30	09.05.2026 15:05:30	Harmonia é a Vida da Empresa	A Verdadeira Escola é a Vida. Horas de Ensino a partir da sabedoria Divina: "Harmonia é a Vida da Empresa"		False	False	False	False	False	False	False	DWSharmonieBetriebe.jpg
733	24045	DasIstMeinWort 18Gebote	LES	00:23:00	09.05.2026 15:35:30	Esta é a Minha Palavra, A e Ω. Capítulo 47: "A correta compreensão dos Mandamentos"	Esta é a Minha Palavra, A e Ω. Capítulo 47: "A correta compreensão dos Mandamentos"		False	False	False	False	False	False	False	Propheten.jpg
735	38610	Brache	DOK	00:18:00	09.05.2026 16:00:30	A nova agricultura para a nova era	O pousio - solo saudável, frutos saudáveis		False	False	False	False	False	False	False	BauenBruecke.jpg
738	45250	BemühtEuchNatur	OFF	00:11:30	09.05.2026 16:25:00	O Espírito do Cristo de Deus se revela por meio de Sua profetisa Gabriele no dia 22 de dezembro de 1996: "Esforcem-se de viver cada vez mais com a natureza. Quanto mais vocês praticarem ficar em silêncio, tanto mais perto vocês chegam do portal interior"  	O Espírito do Cristo de Deus se revela por meio de Sua profetisa Gabriele no dia 22 de dezembro de 1996: "Esforcem-se de viver cada vez mais com a natureza. Quanto mais vocês praticarem ficar em silêncio, tanto mais perto vocês chegam do portal interior"  		False	False	False	False	False	False	False	IT_OFFBemuehtEuchWeihn.jpg
741	44190	LebenIstKlang 1KiZ	LIOS	00:17:00	09.05.2026 16:45:30	Liobani: A vida é som.	Liobani: A vida é som. A escola a para Nova Jerusalém para um tempo diferente no signo do Cristo de Deus, do amor a Deus e ao próximo		False	False	False	False	False	False	False	LiobaniZeichnungVoegel.jpg
743	40689	SichSelbstFinden2 2KiZ	LIOS	00:12:30	09.05.2026 17:05:00	Liobani: Encontrar a si mesmo.	Liobani: Encontrar a si mesmo. A escola a para Nova Jerusalém para um tempo diferente no signo do Cristo de Deus, do amor a Deus e ao próximo		False	False	False	False	False	False	False	IchErzaehle.jpg
745	44884	Evolutionsweg 2KiZ	LIOS	00:10:30	09.05.2026 17:20:30	Liobani: O caminho da evolução. 	Liobani: O caminho da evolução. A escola a para Nova Jerusalém para um tempo diferente no signo do Cristo de Deus, do amor a Deus e ao próximo		False	False	False	False	False	False	False	LiobaniZeichungSonnentanz.jpg
747	40716	BerichtAfrika 01	LIOS	00:10:30	09.05.2026 17:33:00	Liobani - Um relatório de Africa	Liobani - A escola a para Nova Jerusalém para um tempo diferente no signo do Cristo de Deus, do amor a Deus e ao próximo: Um relatório de Africa		False	False	False	False	False	False	False	LIOS_BerichteAusAfrika.JPG
749	13994	Augenblicke	MED	00:14:00	09.05.2026 17:46:30	Momentos com os animais	Momentos com os animais		False	False	False	False	False	False	False	Augenblicke.jpg
750	28416	InnereAndacht 01	MED	00:48:30	09.05.2026 18:00:30	Devocional Interior 1ª Parte	Deus É – E Eu Sou Divino		False	False	False	False	False	False	False	InnereAndacht_PT_Neu.jpg
753	28552	Gemeinschaften 05	FGE	00:19:00	09.05.2026 18:55:00	As Comunidades Livres Sob o Signo do Lírio. Tema: Nós somos seres da lei do universo	As Comunidades Livres Sob o Signo do Lírio. Tema: Nós somos seres da lei do universo		False	False	False	False	False	False	False	Lilie.jpg
755	42723	UnsereHeimat	MED	00:33:30	09.05.2026 19:16:00	Meditação. A Nossa Pátria no SER Puro	Meditação. A Nossa Pátria no SER Puro		False	False	False	False	False	False	False	PT_UnsereHeimat.jpg
758	28447	InnereAndacht 02	MED	00:57:30	09.05.2026 19:55:00	Devocional Interior, 2ª Parte	Desenvolvemos a Nossa Herança Espiritual, Assim Encontrando o Camino ao Reino de Deus		False	False	False	False	False	False	False	InnereAndacht_PT_Neu.jpg
760	45344	Christus Okt25	OFF	00:32:00	09.05.2026 20:55:00	O Cristo de Deus se revelou na Comunidade Central do Senhor para a edificação do Reino da Paz do Cristo de Deus	Em 3 de outubro de 2025, ano 2 da Era Messiânica e Sofiânica		False	False	False	False	False	False	False	ChristusAbbildZelt.jpg
762	34104	ChristusErlösung	MED	00:22:30	09.05.2026 21:30:30	Meditação de Oração. Cristo é Redenção em Nós	Meditação de Oração. Cristo é Redenção em Nós		False	False	False	False	False	False	False	EN_CH92ChristusErloesung.jpg
764	43523	AuflösungFormen 3	SON	00:53:00	09.05.2026 21:55:30	3a Parte. Os preparativos para a dissolução de todas as formas condensadas e o retorno do Cristo de Deus	3a Parte: O retorno dos filhos de Deus – de volta para a unidade de toda a vida e para o amor eterno		False	False	False	False	False	False	False	PT_Aufloesung.jpg
768	40069	BändeEwigesReich 01 WEB	LES	00:42:00	09.05.2026 22:56:00	A partir do Reino Eterno. "Eu Faço Tudo Novo". Dado no ano 1991 e revelado a través da emissária do Reino Eterno, Gabriele.	A partir do Reino Eterno. "Eu Faço Tudo Novo". Dado no ano 1991 e revelado a través da emissária do Reino Eterno, Gabriele.		False	False	False	False	False	False	False	ChristusErlösung.jpg
771	40716	BerichtAfrika 01	LIOS	00:10:30	09.05.2026 23:49:00	Liobani - Um relatório de Africa	Liobani - A escola a para Nova Jerusalém para um tempo diferente no signo do Cristo de Deus, do amor a Deus e ao próximo: Um relatório de Africa		False	False	False	False	False	False	False	LIOS_BerichteAusAfrika.JPG
773	32552	LilienzeitalterFusion	LILIE	01:13:30	10.05.2026 00:00:00	A Idade do Lírio Sophia. A Sabedoria de Deus, o Espírito da Verdade, o Espírito da Fusão: Espírito do Seu Espírito, Amor do Seu Amor	A Idade do Lírio Sophia. A Sabedoria de Deus, o Espírito da Verdade, o Espírito da Fusão: Espírito do Seu Espírito, Amor do Seu Amor		False	False	False	False	False	False	False	ZellOFFBd.jpg
776	35661	1. Gebot Neu	MED	00:28:00	10.05.2026 01:18:00	Meditação de Oração. O Primeiro Mandamento	Meditação de Oração. O Primeiro Mandamento		False	False	False	False	False	False	False	Moses10Geb.jpg
778	14078	Tiefenatmung	MED	00:31:00	10.05.2026 01:47:00	Meditação - "Respiração Profunda"	Meditação - "Respiração Profunda"		False	False	False	False	False	False	False	Tiefenatmung.jpg
780	44877	GottVater Pfingsten25	OFF	00:39:00	10.05.2026 02:19:00	Deus-Pai revelou-se no encontro da Comunidade Cristã Original no Pentecostes, dia 7 de junho de 2025, na Comunidade do Senhor para a edificação do Reino da Paz do Cristo de Deus	Deus-Pai revelou-se no encontro da Comunidade Cristã Original no Pentecostes, dia 7 de junho de 2025, na Comunidade do Senhor para a edificação do Reino da Paz do Cristo de Deus		False	False	False	False	False	False	False	PT_OFF_Pfingsten.jpg
783	42232	FGE VS Les 13 LebeAugenblick	FGE	00:07:00	10.05.2026 03:04:30	Nós somos as Comunidades Livres - Una e seja (13)	Viva o Instante – e você se vê e se reconhece		False	False	False	False	False	False	False	PT_FGE-VS.jpg
786	41756	FGE VS Les 04 SieSindNiAllein	FGE	00:05:00	10.05.2026 03:16:00	Nós somos as Comunidades Livres - Una e seja (4)	Você não está sózinho		False	False	False	False	False	False	False	PT_FGE-VS.jpg
788	27607	InnererWeg 16	GR-IW	00:28:30	10.05.2026 03:23:00	O Caminho Interior à Consciência Cósmica. Nivel Básico da Ordem. Parte 16	O Caminho Interior à Consciência Cósmica. Nivel Básico da Ordem. Parte 16		False	False	False	False	False	False	False	IW_PT.jpg
790	35420	SchuleLeben 10	DWS	00:18:30	10.05.2026 03:54:30	A Verdadeira Escola é a Vida. Horas de Ensino a partir da sabedoria Divina: "O Deus que fala"	A Verdadeira Escola é a Vida. Horas de Ensino a partir da sabedoria Divina: "O Deus que fala"		False	False	False	False	False	False	False	DieWahreSchule.jpg
795	33468	LernenHineinzufühlen	MED	00:28:00	10.05.2026 04:16:00	Meditação - Vamos aprender a ter empatia com o nosso próximo	Meditação - Vamos aprender a ter empatia com o nosso próximo		False	False	False	False	False	False	False	LernenHineinfühlen.jpg
800	47190	Ostern 2026	SON	01:03:30	10.05.2026 04:49:00	Celebração da Família de Deus na Terra	Cristo, o ressuscitado, veio por amor a toda a criação		False	False	False	False	False	False	False	PT_Ostern2026.jpg
804	39760	AllesKommunikation2 WEB	LES	01:09:30	10.05.2026 05:57:00	A Idade Messiânca, Sofiânica. Tudo é Comunicação	A Idade Messiânca, Sofiânica. Tudo é Comunicação		False	False	False	False	False	False	False	ChristusInUns.jpg
807	33929	Bergpredigt 05	LES	00:21:00	10.05.2026 07:10:30	O Sermão da Montanha de Jesus de Nazaré. Parte 5	O Sermão da Montanha de Jesus de Nazaré. Parte 5		False	False	False	False	False	False	False	Berg_PT-00.jpg
813	47153	ChristusAuferstehen	MED	00:24:00	10.05.2026 07:36:30	Cristo deseja ressuscitar em cada um de nós	Meditação dada por Gabriele, a profetisa e emissária do Reino Eterno em 25 de março 2005		False	False	False	False	False	False	False	PT_MED_ChristusAuferstehung.jpg
814	25244	Klassik Seele 50a_26	KONZ1	00:25:30	10.05.2026 08:00:30	Classics for the Soul. Santec Music Orchestra	Classic Soul 50a		False	False	False	False	False	False	False	KlassikSeele.jpg
817	20947	Medikurs1 08	MED	00:33:00	10.05.2026 08:30:00	Meditação Cristã Oríginal - As Forças Divinas da Luz em Mim Transformam Tudo	Meditação Cristã Oríginal - As Forças Divinas da Luz em Mim Transformam Tudo		False	False	False	False	False	False	False	Medikurs.jpg
819	29234	InnereAndacht 12	MED	00:59:00	10.05.2026 09:05:00	Devocional Interior, 12ª Parte	Repouse em você - você é		False	False	False	False	False	False	False	PT_InnereAndacht_TextAmAnfang.jpg
823	27607	InnererWeg 16	GR-IW	00:28:30	10.05.2026 10:11:00	O Caminho Interior à Consciência Cósmica. Nivel Básico da Ordem. Parte 16	O Caminho Interior à Consciência Cósmica. Nivel Básico da Ordem. Parte 16		False	False	False	False	False	False	False	IW_PT.jpg
828	23725	DasIstMeinWort 09	LES	00:27:00	10.05.2026 10:42:30	Esta é a Minha Palavra, A e Ω. Capítulo 6: "Infância e Juventude de Jesus"	Esta é a Minha Palavra, A e Ω. Capítulo 6: "Infância e Juventude de Jesus"		False	False	False	False	False	False	False	PT_DasIStMeinWort2.jpg
831	23937	DasIstMeinWort 17	LES	00:16:30	10.05.2026 11:14:30	Esta é a Minha Palavra, A e Ω. Capítulo 60: "Sobre o pesar"	Esta é a Minha Palavra, A e Ω. Capítulo 60: "Sobre o pesar"		False	False	False	False	False	False	False	Freiheit.jpg
833	41960	Lilienzeitalte 4Entwicklungseb. Teil 1 WEB	LES	00:55:30	10.05.2026 11:38:00	A Idade do Lírio, Sofia, a Sabedoria de Deus. Os Quatro planos de Desenvolvimento, o Berço da Evolução para a Filiação de Deus. Parte 1	A Idade do Lírio, Sofia, a Sabedoria de Deus. Os Quatro planos de Desenvolvimento, o Berço da Evolução para a Filiação de Deus. Parte 1		False	False	False	False	False	False	False	DuSollstNichtToeten.jpg
839	41013	Zelt GottHeilt 07 WEB	LES-ZELT	00:28:30	10.05.2026 12:39:30	Uma leitura do livro "Deus Cura" de Gabriele. Parte 7. Desde o Arco da Aliança do Espírito Livre, desde a Tenda de Deus, a palavra eterna vem diretamente a nós	Uma leitura do livro "Deus Cura" de Gabriele. Parte 7. Desde o Arco da Aliança do Espírito Livre, desde a Tenda de Deus, a palavra eterna vem diretamente a nós		False	False	False	False	False	False	False	GottHeilt.jpg
841	42723	UnsereHeimat	MED	00:33:30	10.05.2026 13:10:30	Meditação. A Nossa Pátria no SER Puro	Meditação. A Nossa Pátria no SER Puro		False	False	False	False	False	False	False	PT_UnsereHeimat.jpg
844	42348	FGE VS Les 17 Liobani	FGE	00:06:30	10.05.2026 13:48:30	Nós somos as Comunidades Livres - Una e seja (17)	Liobani		False	False	False	False	False	False	False	PT_FGE-VS.jpg
846	42349	FGE VS Les 18 GroKosLehren	FGE	00:08:00	10.05.2026 13:57:30	Nós somos as Comunidades Livres - Una e seja (18)	Nós somos as Comunidades Livres - Una e seja (18)		False	False	False	False	False	False	False	PT_FGE-VS.jpg
851	27607	InnererWeg 16	GR-IW	00:28:30	10.05.2026 14:08:30	O Caminho Interior à Consciência Cósmica. Nivel Básico da Ordem. Parte 16	O Caminho Interior à Consciência Cósmica. Nivel Básico da Ordem. Parte 16		False	False	False	False	False	False	False	IW_PT.jpg
853	40752	Männerwelt Teil 1	SON	01:14:00	10.05.2026 14:40:30	O Mundo dos Homens ontem e hoje. Os três atributos do Deus-Pai-Mãe e a capitulação do Satanista. Parte 1	O Mundo dos Homens ontem e hoje. Os três atributos do Deus-Pai-Mãe e a capitulação do Satanista. Parte 1		False	False	False	False	False	False	False	PT_Maenerwelt.jpg
855	40071	WortAuferstanden 02 WEB	LES	00:31:00	10.05.2026 15:55:30	A Palavra ressuscitou e se espalhou pelo mundo. 	Parte 2: O mundo fala da paz. Onde está a paz?		False	False	False	False	False	False	False	ZellOFFBd.jpg
857	46879	GottVater Feb26	OFF	00:36:00	10.05.2026 16:30:00	Deus-Pai se revelou na Comunidade Central do Senhor para a edificação do Reino da Paz do Cristo de Deus em fevereiro de 2026, o terceiro ano da Era Messiânica e Sofiânica	Deus-Pai se revelou na Comunidade Central do Senhor para a edificação do Reino da Paz do Cristo de Deus em fevereiro de 2026, o terceiro ano da Era Messiânica e Sofiânica		False	False	False	False	False	False	False	CHFeuerSchüssel.jpg
863	45448	JesusKamFürTiere	LES	00:39:00	10.05.2026 17:12:30	Jesus de Nazaré também veio para os animais	Jesus de Nazaré também veio para os animais		False	False	False	False	False	False	False	BundGottTiere.jpg
869	28683	InnereAndacht 06	MED	00:53:30	10.05.2026 17:59:30	Devocional Interior, 6ª Parte	A Oração Profunda Nos Dá a Experiencia do Silêncio Infinito e da Paz Interior”		False	False	False	False	False	False	False	InnereAndacht_PT_Neu.jpg
872	34150	Bergpredigt 09	LES	00:20:30	10.05.2026 18:56:30	O Sermão da Montanha de Jesus de Nazaré. Parte 9	O Sermão da Montanha de Jesus de Nazaré. Parte 9		False	False	False	False	False	False	False	Berg_PT-00.jpg
874	34151	Bergpredigt 10	LES	00:20:30	10.05.2026 19:18:00	O Sermão da Montanha de Jesus de Nazaré. Parte 10	O Sermão da Montanha de Jesus de Nazaré. Parte 10		False	False	False	False	False	False	False	Berg_PT-00.jpg
880	44884	Evolutionsweg 2KiZ	LIOS	00:10:30	10.05.2026 19:44:00	Liobani: O caminho da evolução. 	Liobani: O caminho da evolução. A escola a para Nova Jerusalém para um tempo diferente no signo do Cristo de Deus, do amor a Deus e ao próximo		False	False	False	False	False	False	False	LiobaniZeichungSonnentanz.jpg
884	27607	InnererWeg 16	GR-IW	00:28:30	10.05.2026 19:59:00	O Caminho Interior à Consciência Cósmica. Nivel Básico da Ordem. Parte 16	O Caminho Interior à Consciência Cósmica. Nivel Básico da Ordem. Parte 16		False	False	False	False	False	False	False	IW_PT.jpg
